title,requirementSalesforce Manager - Online Services,"SHIS-1613331 Salesforce Manager - Online Services Description Responsible for product management of custom enterprise online services applications and the implementation of vendor web applications, content management systems, mobile applications and web portals. Oversees and directs communication between technical staff, other managers, and team members, both inside and outside of Information Services (IS). Works closely with development teams and business stakeholders providing oversight for product release management, requirements, project management, training and product launch. Qualifications ‰Û¢ Extensive experience interpreting user needs and writing or editing functional specifications for new systems, systems changes or system enhancements. ‰Û¢ Management of Salesforce.com APEX environment; including design and delivery of custom Force.cm applications and managed package application in SalesForce environment ‰Û¢ Salesforce.com Administrator certified ‰Û¢ Management of Salesforce.com SFA and Force.com architecture. ‰Û¢ Technical or functional experience with Salesforce.com SFA application capabilities including Campaign, Contact, Account, Lead and Opportunity Management as well as Forecasting. ‰Û¢ Strong problem-solving and analytic skills. ‰Û¢ Strong project management and organization skills ‰Û¢ Ability to work in a fast paced, demanding, and fluid environment Management of vendor relations, contracting, delivery ‰Û¢ Experience working in a controlled/validated environment (Sarbanes Oxley, HIPAA, HITECH) ‰Û¢ Experience in ETL Experience managing technical teams and providing leadership using a standardized SDLC as typically acquired in 7 to 10 years. Minimum 3 years in an enterprise development environment; preferably with a commercial software company. Excellent written and verbal communication skills, good presentation and team building skills. Manage and/or be involved in multiple projects (5-10) at the same time. Understand business requirements and understand supporting technical functional requirements. Create project plans and manage project tasks to the plan. Good organizational skills and ability to prioritize multiple projects and objectives in a rapidly changing environment, and deliver quality products. Act as a department lead. Articulate technical and user needs so that they are concise and easily understood by all. Proficient at specifying user requirements, interacting with technical staff, application staff and vendors and documenting system needs, outcomes, and procedures. Primary Location: California-Greater Sacramento Area-Mather Organization: Sutter Health Information Services Employee Status: Regular Accepted Applications: All Candidate Applications Accepted Benefits: Yes Position Status: Exempt Union: No Job Shift: Day Shift Hours- 8 Hour Shift Days of the Week Scheduled: Monday-Friday Schedule: Full Time Hours Per 2wk Pay Period: 80 All qualified applicants will receive consideration for employment without regard to race, color, creed, religion, marital status, sexual orientation, registered domestic partner status, sex, gender, gender identity, or expression, ancestry, national origin, age, medical condition, physical or mental disability, military or protected veteran status, political affiliation, pregnancy, childbirth or related medical condition, genetic information or any other characteristic made unlawful by local, state, or federal law, ordinance or regulation. External hires must pass a background check/drug screen. Qualified applicants with arrest and/or conviction records will be considered for employment in a manner consistent with Federal, state, and local laws, including but not limited to the San Francisco Fair Chance Ordinance.""Analyst, Quality Management Systems","PAMF-1612772 Analyst, Quality Management Systems Description Job Summary: The Analyst coordinates and performs work related to the Quality and Patient Safety (QPS) and Risk Management (RM) departments‰Ûª Midas data systems and reporting needs, serving as the PAMF Midas Site Manager. This position provides technical and ‰ÛÏgo-to‰Û expert support for the QPS/RM database applications (e.g. Midas, Statit); development and distribution of PAMF PS/RM reports and scorecards, training of all personnel. This role takes direction from the QPS Director, and is responsible for working collaboratively with other Midas resources across the Sutter Health system. Database application management includes providing expert application and technical management for the product line in addition to providing more complex triage and troubleshooting assistance to the product customers. Engages in problem management identification, classification, and resolution activities within the applications. This position ensures the accuracy of the databases by working with staff on processes for data collection, data definitions, and accuracy of reporting. Manages new user access, password resets, new user/termination reports, new department/relocation builds, and re-training on the Midas application. This position is also responsible for the generation and timely distribution of numerous monthly, quarterly, annual and ad hoc reports/scorecards, for QPS/RM departments and senior management. This may involve providing executive summaries and detailed analysis on key clinical initiatives. Report/Scorecard management involves creative development of standard user friendly reports within the application, as well as appropriate statistical, visual and/or narrative displays of data in a manner that is easily interpreted by the audience. Responsible for The Analyst will be responsible for data integrity in reporting data in a timely and efficient manner. This frequently includes ad hoc projects that require critical thinking and a proactive approach to problem solving, and meeting deadlines consistently. Data must be analyzed and often combined from various systems to create reports necessary for analysis and process improvements. This position is responsible for training all personnel on the aspects of the database. Excellent customer service skills are required for this position. Technical Support of Database Applications for Quality and Patient Safety/Risk Management Departments Works closely with business and clinical operations to support usage of applications by end users. Maintains and updates worklist infrastructure. Applications primarily include Midas and Statit, but may involve other applications as assigned. Manages Midas and Statit access, new users, terminations, password resets, new department/relocation builds using security roles Maintains overall system functionality and effectiveness including troubleshooting, building tools, data maintenance, data definitions, recovery, and system optimization where appropriate. Reviews and manages various system log files, error reports, alert audit logs, and security access logs, as assigned. Ensures accuracy of the databases by working with staff on the processes for data collection, data definitions, and accuracy of reporting. Consults with customers and vendors to identify and resolve advanced problems, following through to ensure final resolution. Keeps assigned tables and profiles updated. Communicates status of key issues on a regular basis to management. Communicates status of incidents and problems to key stakeholders. Training Conducts training sessions as required for health care providers and other internal customers. Maintains thorough knowledge in the application‰Ûªs design and use; continues to increase knowledge as the product functionality is changed or enhanced, through attendance of appropriate application and technical training sessions. Attends training sessions and learns how to use other software applications in order to actively and effectively use those applications during interface and integration testing. Develops a working knowledge of application database, desktop configuration, and application configuration for effective participation in all phases of project implementation and application support. Development, Maintenance and Distribution of Data Reports and Scorecards Expert ability to work with complex databases and programs. Coordinate data from different sources and combine data and aggregate data into graphic format that the customer can utilize. Midas - Compiles and manages data from Datavision Navigator, Reportrack, focus studies, etc. Builds reports for end users as appropriate. Statit ‰ÛÒ Builds indicators, scorecards, layouts and views. Builds data source connections and manages data. Creatively design reports with minimal input in a display format that is easy to understand and conveys meaningful information. Analyze data for content and validity and determine if the data trends are accurate, appropriate and justified. Produce and distribute reports and scorecards on schedule with minimal oversight. Areas of report responsibility include, but are not limited to: Quality and Patient Safety, Risk Management Leadership and Accountability Identifies innovative solutions to achieve Risk Management and Quality and Patient Safety goals, objectives and deliverables. Works collaboratively with other Midas site managers and resources across the Sutter Health system. Follows through to ensure final resolution of problems, recommending longer term solutions when appropriate and communicating back to the individual reporting the problem. Demonstrates a clear understanding of, and consistently adheres to, policies and procedures Attends and actively participates in department meetings and classes. Adheres to department and facility policies and procedures and supports Sutter Health philosophies and initiatives. Qualifications Required: High School Diploma or equivalent. Bachelors preferred. Experience & Knowledge The incumbent should possess experience and knowledge in: Knowledge of health care operations, with a focus on quality management, patient relations and risk management services in acute and non-acute outpatient settings is strongly preferred. Includes structure, department-specific policies and procedures and workflows. Demonstrated knowledge of information technoogy, including management of databases, experience as second or third level technical support, troubleshooting and system maintenance preferred. Prior experience in the use of information system applications in the practicing health care environment is required. Healthcare applications or relevant professional experienece as typically acquired in 3 to 6 years. Strongly prefer in-depth experience with Midas, including Quality, Patient Relations, and Risk modules. Experience with Statit PPR, Statit PiMD, and Epic is beneficial. Strong problem and issue resolution experience. In-depth of knowledge of application environments including production, test and interfaces is preferred. Ability to be involved in, and prioritize multiple projects at the same time. Excellent organization skills; ability to prioritize multiple activities and objectives in a rapidly changing environment, and deliver quality service. Project management experience strongly preferred. Ability to work effectively with health care application users, vendors, and technical professionals. Committed to providing exceptional customer service and responding to user needs in a prompt, courteous manner. Excellent teamwork and collaboration skills are required. Must be able to take direction, or be self-directed as the situation requires. Excellent communication skills, oral and written, are required. Includes ability to convey salient points to technical and non-techincal audiences concisely in presentation materials. Strong evidence of critical thinking skills. Creative, independent and inquisitive. Strong knowledge of word processing, spreadsheet and presentation computer programs, preferably Microsoft. Primary Location: California-Bay Area Organization: Palo Alto Medical Foundation Employee Status: Regular Accepted Applications: All Candidate Applications Accepted Benefits: Yes Position Status: Non-Exempt Union: No Job Shift: Day Shift Hours- 8 Hour Shift Days of the Week Scheduled: Monday-Friday Shift Start Time: 8:00 Shift End Time: 5:00 Schedule: Full Time Hours Per 2wk Pay Period: 80 All qualified applicants will receive consideration for employment without regard to race, color, creed, religion, marital status, sexual orientation, registered domestic partner status, sex, gender, gender identity, or expression, ancestry, national origin, age, medical condition, physical or mental disability, military or protected veteran status, political affiliation, pregnancy, childbirth or related medical condition, genetic information or any other characteristic made unlawful by local, state, or federal law, ordinance or regulation. External hires must pass a background check/drug screen. Qualified applicants with arrest and/or conviction records will be considered for employment in a manner consistent with Federal, state, and local laws, including but not limited to the San Francisco Fair Chance Ordinance."Application Team Supervisor-EHR In-patient Pharmacy,"SHIS-1613057 Application Team Supervisor-EHR In-patient Pharmacy Description Supervises applications staff, including coordinating cross-functional teams and resources across Sutter Health Information Services, Sutter Health Affiliates, and/or other system related functional resources required to implement and support Information Services projects at the local, regional or enterprise level. May include new applications, modules, and software installations, interface/integration, hardware upgrades, and major application upgrades. Works closely with physicians, clinical staff, and/or business operational leadership within Sutter Health Information Services and Affiliates across the system to provide support, training, and participate in goals/objectives planning and prioritization as it relates to Information Services applications. Ensures staff adheres to standards. Qualifications EPIC Willow Pharmacy experience Education BA/BS Degree or equivalent Experience EPIC Willow Pharmacy experience preferred ‰Û¢ Information systems, project management and/or equivalent management experience, along with the use of tools and processes to support effective documentation and communication, as typically acquired in 3 to 6 years. ‰Û¢ Experience in successfully leading teams and implementing and supporting business and/or clinical applications that require coordination of resource, budget development, and project planning. ‰Û¢ Demonstrated technical and business experience. ‰Û¢ Consulting with vendor, clients and management. ‰Û¢ Strong problem and issue resolution experience. ‰Û¢ Expert at specifying user requirements. ‰Û¢ In-depth knowledge of industry standards to support business requirements. ‰Û¢ Knowledge of healthcare operations and structure, general requirements in an integrated delivery system, and use of information system applications in the practicing healthcare environment. ‰Û¢ In-depth of knowledge of life cycle of application environments. ‰Û¢ Mastery of assigned application(s) and broad understanding of integrated systems. ‰Û¢ Thorough understanding of hospital inpatient, clinic outpatient operations, and/or financial software along with understanding the technical environment of product lines for which they are responsible. ‰Û¢ Leadership skills. ‰Û¢ Ability to be involved in multiple projects at the same time. ‰Û¢ Excellent organization skills and ability to prioritize multiple activities and objectives in a rapidly changing environment, and deliver quality service. ‰Û¢ Work closely with healthcare application users, vendors, and technical professionals. ‰Û¢ Committed to providing exceptional customer service and responding to user needs in a prompt, courteous manner. ‰Û¢ Strong analytical and critical thinking skills. ‰Û¢ Exceptional written, verbal and presentation skills with the ability to communicate complex technical issues in terms clearly understood by technical and non-technical audiences. ‰Û¢ Influence others without direct lines of authority. ‰Û¢ Strong collaboration and consulting skills. ‰Û¢ Self motivated, self-directed and independent thinking as well as an effective team player. ‰Û¢ Ability to take the most highly complex problems, requirements, or strategies; research solutions and take from concept to implementation for desired outcomes. Primary Location: California-Greater Sacramento Area-Mather Organization: Sutter Health Information Services Employee Status: Regular Accepted Applications: All Candidate Applications Accepted Benefits: Yes Position Status: Exempt Union: No Job Shift: Day Shift Hours- 8 Hour Shift Days of the Week Scheduled: Monday-Friday Schedule: Full Time Hours Per 2wk Pay Period: 80 All qualified applicants will receive consideration for employment without regard to race, color, creed, religion, marital status, sexual orientation, registered domestic partner status, sex, gender, gender identity, or expression, ancestry, national origin, age, medical condition, physical or mental disability, military or protected veteran status, political affiliation, pregnancy, childbirth or related medical condition, genetic information or any other characteristic made unlawful by local, state, or federal law, ordinance or regulation. External hires must pass a background check/drug screen. Qualified applicants with arrest and/or conviction records will be considered for employment in a manner consistent with Federal, state, and local laws, including but not limited to the San Francisco Fair Chance Ordinance."Desktop/Device Engineer 2-Citrix XenDesktop,"SHIS-1613168 Desktop/Device Engineer 2-Citrix XenDesktop Description Analyzes, designs, develops, and maintains computer/mobile devices system standards including a variety of applications, proprietary and standard terminals for host-based systems, multi-tier client/server and LAN applications. Develops computer/mobile devices system standards which are secure, robust, cost-effective and meet the functional needs of the organization. Qualifications Prefer canadidates with 6+ years of Desktop Engineering experiences Knowledge of Citrix XenDesktop in a Healthcare environment Desktop related technical support experience within a major organization installation as typically acquired in 3 to 5 years. Advanced knowledge of Active Directory and associated file systems. Advanced knowledge of network topology. Handle multiple complex projects simultaneously while interacting with a variety of technical personnel and departments. Strong technical skills in installing, upgrading, and maintaining computer/mobile devices and associated peripheral equipment in a large corporate environment and basic network administration. Analyze, troubleshoot and implement computer/mobile devices security. Proven experience in creating and publishing documentation for both end-users and technical personnel. Thorough knowledge of technical architecture including computer/mobile devices hardware and operating systems. Demonstrated proficiency in system administration tools. Create and execute robust test plans for automation, installation, and system upgrades. Functional understanding of MSI technology, personal computers. Advanced understanding of Windows products and software deployment and desktop patching methodologies. Ability and desire to automate processes and a logical and structured approach to troubleshooting and decision making. Ability to work independently and as part of a team. Strong written and verbal communication skills. Primary Location: California-Greater Sacramento Area-Mather Organization: Sutter Health Information Services Employee Status: Regular Accepted Applications: All Candidate Applications Accepted Employment Incentive: No Employee Referral Bonus: No Benefits: Yes Position Status: Non-Exempt Union: No Job Shift: Day Shift Hours- 8 Hour Shift Days of the Week Scheduled: Monday-Friday Shift Start Time: 8am Shift End Time: 5pm Schedule: Full Time Hours Per 2wk Pay Period: 80 All qualified applicants will receive consideration for employment without regard to race, color, creed, religion, marital status, sexual orientation, registered domestic partner status, sex, gender, gender identity, or expression, ancestry, national origin, age, medical condition, physical or mental disability, military or protected veteran status, political affiliation, pregnancy, childbirth or related medical condition, genetic information or any other characteristic made unlawful by local, state, or federal law, ordinance or regulation. External hires must pass a background check/drug screen. Qualified applicants with arrest and/or conviction records will be considered for employment in a manner consistent with Federal, state, and local laws, including but not limited to the San Francisco Fair Chance Ordinance."Desktop/Device Engineer 2-Citrix XenDesktop,"SHIS-1613147 Desktop/Device Engineer 2-Citrix XenDesktop Description Analyzes, designs, develops, and maintains computer/mobile devices system standards including a variety of applications, proprietary and standard terminals for host-based systems, multi-tier client/server and LAN applications. Develops computer/mobile devices system standards which are secure, robust, cost-effective and meet the functional needs of the organization. Qualifications Prefer canadidates with 6+ years of Desktop Engineering experiences Knowledge of Citrix XenDesktop in a Healthcare environment Desktop related technical support experience within a major organization installation as typically acquired in 3 to 5 years. Advanced knowledge of Active Directory and associated file systems. Advanced knowledge of network topology. Handle multiple complex projects simultaneously while interacting with a variety of technical personnel and departments. Strong technical skills in installing, upgrading, and maintaining computer/mobile devices and associated peripheral equipment in a large corporate environment and basic network administration. Analyze, troubleshoot and implement computer/mobile devices security. Proven experience in creating and publishing documentation for both end-users and technical personnel. Thorough knowledge of technical architecture including computer/mobile devices hardware and operating systems. Demonstrated proficiency in system administration tools. Create and execute robust test plans for automation, installation, and system upgrades. Functional understanding of MSI technology, personal computers. Advanced understanding of Windows products and software deployment and desktop patching methodologies. Ability and desire to automate processes and a logical and structured approach to troubleshooting and decision making. Ability to work independently and as part of a team. Strong written and verbal communication skills. Primary Location: California-Greater Sacramento Area-Mather Organization: Sutter Health Information Services Employee Status: Regular Accepted Applications: All Candidate Applications Accepted Employment Incentive: No Employee Referral Bonus: No Benefits: Yes Position Status: Non-Exempt Union: No Job Shift: Day Shift Hours- 8 Hour Shift Days of the Week Scheduled: Monday-Friday Shift Start Time: 8am Shift End Time: 5pm Schedule: Full Time Hours Per 2wk Pay Period: 80 All qualified applicants will receive consideration for employment without regard to race, color, creed, religion, marital status, sexual orientation, registered domestic partner status, sex, gender, gender identity, or expression, ancestry, national origin, age, medical condition, physical or mental disability, military or protected veteran status, political affiliation, pregnancy, childbirth or related medical condition, genetic information or any other characteristic made unlawful by local, state, or federal law, ordinance or regulation. External hires must pass a background check/drug screen. Qualified applicants with arrest and/or conviction records will be considered for employment in a manner consistent with Federal, state, and local laws, including but not limited to the San Francisco Fair Chance Ordinance."