title,requirementSenior Software Architect - Innovation Center - Mountain View,"PAMF-1600774 Senior Software Architect - Innovation Center - Mountain View Description Description About the Palo Alto Medical Foundation Innovation Center The Druker Center for Health Systems Innovation (http://innovation.pamf.org/) (IC) is the innovation arm of the Palo Alto Medical Foundation (PAMF), an affiliate of Sutter Health. Its mission is to invent, catalyze and deploy breakthrough innovations as a partner in advancing the health and wellbeing of communities. Established in 2010, we apply human-centered design and leverage technology to create scalable solutions that address the pressing health challenges of our time. PAMF is a multi-specialty healthcare provider in the San Francisco Bay Area, caring for patients primarily in an outpatient setting in San Mateo, Santa Clara, Santa Cruz and Alameda Counties. PAMF is an affiliate of Sutter Health, a family of doctors and hospitals serving more than 100 communities across Northern California. Job Summary The Senior Software Architect on our Innovation Center team will lead design and development of innovative web applications that improve the health of populations, integrating community health with a new level of personalized clinical care. This is an opportunity to work for social good and make a contribution to programs that raise the health status of the communities we live in. Sutter Health-Palo Alto Medical Foundation has a long-standing reputation for providing best-in-class patient care and demonstrated leadership in healthcare innovation. The Innovation Center is seeking a Senior Software Architect to lead development and scaling of our linkAgesTM (http//www.linkages.org) suite of web applications and other Innovation Center products as we deploy throughout Sutter Health‰Ûªs northern California footprint and nationwide to other health systems. This includes integration with our electronic medical record (EMR) and personal health record (PHR) systems. Our ultimate goal is to understand and address social determinants and social well-being in our patient population, seamlessly integrated into the care we provide. You will design and manage the rapid prototyping and build of new applications, build for scale and cross-platform accessibility on deployed applications, and further our existing EMR and PHR integration. You will work with a diverse team that includes business leaders, developers (both internal and external), data scientists, ethnographers, designers, and product managers to create useful and elegant solutions. Be part of a team that is transforming healthcare. This is a unique opportunity to: Join a true innovation organization: Work with a multidisciplinary team on disruptive solutions that bridge many sectors: medicine, community health, technology, non-profit. Out-of-the-box thinking is not only encouraged, it‰Ûªs a must. Be a healthcare entrepreneur with impact: Have a seat at the table. Your leadership and work will be pivotal to creating scalable and sustainable solutions that truly impact patient experience. Work for social good: We‰Ûªre building programs designed to raise the quality of life and health status of our communities. Know that your contributions can change the lives of vulnerable populations. Be a part of building community. Responsibilities Technical Strategic Planning and Leadership Lead development of technical strategy, long term roadmap, implementation plan, and detailed deliverables for all IC technical platforms Responsible for end to end current and future state architecture for all IC technical platforms Integrate input and complex viewpoints from business leaders, team members, external partners and other key stakeholders to develop solutions that translate business objectives to technical strategies Design IC technical platform infrastructure to account for both quick prototypes and enterprise capability to support scale and sustainability Technical Platform Implementation Leadership Drive development of quick iterative functional prototypes that move understanding of product requirements forward Lead development and deployment of enterprise scale IC technical platforms and applications Design and lead integrations with 3rd party applications as needed (e.g., Epic) Maintain a deep understanding of prevailing technology, applications, industry best practices, business processes and architectural patterns and ensure consistency with IC technical platforms Ensure knowledge transfer, training, and appropriate documentation as products transition from prototype to enterprise to general operations Team Management Responsible for leading teams to execute on technical strategy, roadmap, and implementation plan Provide technical guidance and mentoring to direct reports Communicate with other team members to ensure alignment with broader business goals, seek input, and ensure other team members‰Ûª clear understanding of IC technical platforms External Partner and Vendor Management When needed to meet technical strategy, lead research and identification of external partners and vendors, develop and negotiate contract terms Manage relationships with external partners and vendors to ensure alignment and delivery of work product Design integrations with external partner/ vendor applications and manage teams to implement Communication and Influence with Senior Leadership Communicate with senior leadership and all relevant stakeholders to ensure alignment around technical strategy and ensure that technical strategy consistently meets business objectives Lead collaboration meetings to drive solutioning related to technical strategy Qualifications Required: Bachelors EE/CE/CS or equivalent education/experience. Required Experience 10+ years as a software architect: demonstrated leadership and applied expertise in enterprise scale web applications programming, databases, and networking connectivity Experience in all aspects of software product lifecycle, from concept to fast prototype, design, build, deployment, and support. Ability to translate business strategy into technical vision and strategy through prototype creation, refinement and enterprise scale implementation Deep expertise in Epic EHR Ambulatory and MyChart Experience in translating needs of business partner/clients to application design using industry standard logical and physical modeling (e.g., E-R diagrams) Track record of leading and mentoring high performing teams in a fast paced environment Demonstrated ability in consulting with vendors, clients, and management in order to gather functional requirements as input into application architecture design, prototype, and development efforts. Skilled at identifying appropriate external partners and vendors, negotiating contract terms, and collaborating to achieve timely deliverables General knowledge of a variety of IS disciplines/technologies to include: Databases, Network Servers, PCs, and Systems Engineering Knowledge of leading and emerging software products, technologies and products Additional Preferred Experience Health care work experience Epic certified in Ambulatory and MyChart Experience in Epic Cache code development Experience with OpenID Familiarity with Human Centered Design processes Ability to communicate complex technical issues in terms clearly understood by technical and non-technical audiences Primary Location: California-Bay Area-Mountain View Organization: Palo Alto Medical Foundation Employee Status: Regular Accepted Applications: All Candidate Applications Accepted Benefits: Yes Position Status: Exempt Union: No Job Shift: Day Shift Hours- 8 Hour Shift Days of the Week Scheduled: Monday-Friday Shift Start Time: Varied Shift End Time: Varied Schedule: Full Time Hours Per 2wk Pay Period: 80 All qualified applicants will receive consideration for employment without regard to race, color, religion, sex, national origin, sexual orientation, protected veteran status, or disability status. External hires must pass a background check/drug screen. Qualified applicants with arrest and/or conviction records will be considered for employment in a manner consistent with Federal, state and local laws, including but not limited to the San Francisco Fair Chance Ordinance.""Data Warehouse Analyst, 3","SHIS-1611571 Data Warehouse Analyst, 3 Description Leads the collection of system/business requirements and the documentation of business and technical data dictionaries/metadata and specifications in support of complex strategic Enterprise Data Warehouse (EDW) solutions, including critical strategic assignments. Prepares documentation for developers to build EDW solutions. Qualifications Relevant work experience as typically acquired in 6 to 8 years. Healthcare experience is highly desired. Deep expertise of presentations, word processing and spreadsheet applications, preferably Microsoft. In-depth working experience with data modeling tools and EDW design concepts. Expert experience leading and writing technical specifications. Ability to facilitate meetings and lead group discussions for complex projects. Experience making independent decisions related to packaging data for Business Intelligence applications. Deep understanding of database and data warehouse design concepts. Expert SQL skills. Advanced written, verbal and presentation skills. Ability to develop and deliver training. Expert analytical skills. Good organization, prioritization and time-management skills. Strong interpersonal skills with vendors, co-workers and users. Ability to work independently and as a team member on multiple project teams. Ability to multi-task and provide contributions to all levels of the organization. Primary Location: California-Greater Sacramento Area-Mather Organization: Sutter Health Information Services Employee Status: Regular Accepted Applications: All Candidate Applications Accepted Benefits: Yes Position Status: Non-Exempt Union: No Job Shift: Day Shift Hours- 8 Hour Shift Days of the Week Scheduled: Monday-Friday Schedule: Full Time Hours Per 2wk Pay Period: 80 All qualified applicants will receive consideration for employment without regard to race, color, creed, religion, marital status, sexual orientation, registered domestic partner status, sex, gender, gender identity, or expression, ancestry, national origin, age, medical condition, physical or mental disability, military or protected veteran status, political affiliation, pregnancy, childbirth or related medical condition, genetic information or any other characteristic made unlawful by local, state, or federal law, ordinance or regulation. External hires must pass a background check/drug screen. Qualified applicants with arrest and/or conviction records will be considered for employment in a manner consistent with Federal, state, and local laws, including but not limited to the San Francisco Fair Chance Ordinance.""Data Warehouse Developer, 2","SHIS-1611346 Data Warehouse Developer, 2 Description Participates and guides in the development of Enterprise Data Warehouse (EDW) solutions, developing data acquisition, standardization and aggregation solutions for the delivery of metrics, key performance indicators (KPI), dashboards and analytics. Qualifications Relevant work experience as typically acquired 3 to 5 years. Healthcare experience is desired. Expert with presentations, word processing and spreadsheet applications, preferably Microsoft. Experience working with Data Warehouse methodologies. Experience with ETL and programming language. Advance experience with data visualization concepts. Understanding of metrics, measures and KPIs. Expert SQL skills. Strong written, verbal and presentation skills. Advanced analytical skills. Good organization, prioritization and time-management skills. Strong interpersonal skills with vendors, co-workers and users. Ability to work independently and team member of multiple project teams. Primary Location: California-Greater Sacramento Area-Mather Organization: Sutter Health Information Services Employee Status: Regular Accepted Applications: All Candidate Applications Accepted Benefits: Yes Position Status: Non-Exempt Union: No Job Shift: Day Shift Hours- 8 Hour Shift Days of the Week Scheduled: Monday-Friday Schedule: Full Time Hours Per 2wk Pay Period: 80 All qualified applicants will receive consideration for employment without regard to race, color, creed, religion, marital status, sexual orientation, registered domestic partner status, sex, gender, gender identity, or expression, ancestry, national origin, age, medical condition, physical or mental disability, military or protected veteran status, political affiliation, pregnancy, childbirth or related medical condition, genetic information or any other characteristic made unlawful by local, state, or federal law, ordinance or regulation. External hires must pass a background check/drug screen. Qualified applicants with arrest and/or conviction records will be considered for employment in a manner consistent with Federal, state, and local laws, including but not limited to the San Francisco Fair Chance Ordinance.""Data Warehouse Developer, 3","SHIS-1611345 Data Warehouse Developer, 3 Description Leads the development of Enterprise Data Warehouse (EDW) solutions, developing data acquisition, standardization and aggregation solutions for the delivery of metrics, key performance indicators (KPI), dashboards and analytics. Qualifications Relevant work experience as typically acquired in 6 to 8 years. Healthcare experience is desired. Expert with presentations, word processing and spreadsheet applications, preferably Microsoft. Advance experience working with Data Warehouse methodologies. Expert experience with ETL and programming language. Expert experience with data visualization concepts. Advance understanding of metrics, measures and KPIs. Expert SQL skills. Strong written, verbal and presentation skills. Advanced analytical skills. Good organization, prioritization and time-management skills. Strong interpersonal skills with vendors, co-workers and users. Ability to work independently and as a team member of multiple project teams. Primary Location: California-Greater Sacramento Area-Mather Organization: Sutter Health Information Services Employee Status: Regular Accepted Applications: All Candidate Applications Accepted Benefits: Yes Position Status: Non-Exempt Union: No Job Shift: Day Shift Hours- 8 Hour Shift Days of the Week Scheduled: Monday-Friday Schedule: Full Time Hours Per 2wk Pay Period: 80 All qualified applicants will receive consideration for employment without regard to race, color, creed, religion, marital status, sexual orientation, registered domestic partner status, sex, gender, gender identity, or expression, ancestry, national origin, age, medical condition, physical or mental disability, military or protected veteran status, political affiliation, pregnancy, childbirth or related medical condition, genetic information or any other characteristic made unlawful by local, state, or federal law, ordinance or regulation. External hires must pass a background check/drug screen. Qualified applicants with arrest and/or conviction records will be considered for employment in a manner consistent with Federal, state, and local laws, including but not limited to the San Francisco Fair Chance Ordinance.""Technical Analyst, 2","SHIS-1611192 Technical Analyst, 2 Description Supports technical standards and testing of enterprise policies, systems, and/or applications. Performs moderately complex technical analysis, design, support, implementation, and project management for technology related activities with minimal supervision. Provides customer support for technology, leveraging Remedy to track and perform necessary trend analysis of issues. Provides support to the applications, network, systems, and storage, and escalates issues as needed. Assists team with the on-going tracking of enterprise technology maintenance contracts when applicable. Provides training and mentoring to Technical Analyst 1. Qualifications Preferred experience: single sign on, reverse proxy solutions like SiteMinder. Experience with TeamSite, OpenDeploy, LiveSite. Technical analysis experience, ability to work in a team environment, maintain a high level of customer service, and possess attention to detail as typically acquired in 3 to 5 years. Manage multiple competing priorities in a fast paced dynamic working environment. Assist in the development of process and procedures. Proven problem determination and resolution experience. Previous project management experience is preferred. Develop methodologies for analysis, development, implementation, and testing is preferred. Experience in production related issues by performing cause analysis. Medium to large organization experience with Hospital and/or other health care experience preferred. Knowledge and understanding of information technology concepts and technologies, as is knowledge of computer systems hardware and software, entity relationship models, design, protocols, and methodologies. Ability to document and implement short and long term plans of action. Good verbal, written, organizational, problem solving and interpersonal skills. Adhere to change management policies. Interpret error logs and troubleshoot system and application issues. Communicate effectively; work independently and/or in a team environment. Proven ability to document system workflows. Manage project tasks to the project plan for multiple projects. Good time management and organization skills. Proven ability to prioritize multiple activities and objectives in a rapidly changing environment, and deliver quality service with minimal supervision. Interact with internal and enterprise staff in a professional, effective manner. Convey technical concepts and user needs to ‰ÛÏlay‰Û individuals, as well as communicate technical issues. High commitment to detail and accuracy. Support team members. Maintain a positive attitude and be willing to learn new skills. Maintain a high level of energy and creativity. Learn internal applications to provide high level of service. Degree is required or Equivalent Education/Experience. BA/BS is desired Primary Location: California-Greater Sacramento Area-Mather Organization: Sutter Health Information Services Employee Status: Regular Accepted Applications: All Candidate Applications Accepted Benefits: Yes Position Status: Non-Exempt Union: No Job Shift: Day Shift Hours- 8 Hour Shift Days of the Week Scheduled: Monday-Friday Schedule: Full Time Hours Per 2wk Pay Period: 80 All qualified applicants will receive consideration for employment without regard to race, color, creed, religion, marital status, sexual orientation, registered domestic partner status, sex, gender, gender identity, or expression, ancestry, national origin, age, medical condition, physical or mental disability, military or protected veteran status, political affiliation, pregnancy, childbirth or related medical condition, genetic information or any other characteristic made unlawful by local, state, or federal law, ordinance or regulation. External hires must pass a background check/drug screen. Qualified applicants with arrest and/or conviction records will be considered for employment in a manner consistent with Federal, state, and local laws, including but not limited to the San Francisco Fair Chance Ordinance.""Technical Analyst, 2","SHIS-1610610 Technical Analyst, 2 Description Supports technical standards and testing of enterprise policies, systems, and/or applications. Performs moderately complex technical analysis, design, support, implementation, and project management for technology related activities with minimal supervision. Provides customer support for technology, leveraging Remedy to track and perform necessary trend analysis of issues. Provides support to the applications, network, systems, and storage, and escalates issues as needed. Assists team with the on-going tracking of enterprise technology maintenance contracts when applicable. Provides training and mentoring to Technical Analyst 1. Qualifications Preferred experience: single sign on, reverse proxy solutions like SiteMinder. Experience with TeamSite, OpenDeploy, LiveSite. Technical analysis experience, ability to work in a team environment, maintain a high level of customer service, and possess attention to detail as typically acquired in 3 to 5 years. Manage multiple competing priorities in a fast paced dynamic working environment. Assist in the development of process and procedures. Proven problem determination and resolution experience. Previous project management experience is preferred. Develop methodologies for analysis, development, implementation, and testing is preferred. Experience in production related issues by performing cause analysis. Medium to large organization experience with Hospital and/or other health care experience preferred. Knowledge and understanding of information technology concepts and technologies, as is knowledge of computer systems hardware and software, entity relationship models, design, protocols, and methodologies. Ability to document and implement short and long term plans of action. Good verbal, written, organizational, problem solving and interpersonal skills. Adhere to change management policies. Interpret error logs and troubleshoot system and application issues. Communicate effectively; work independently and/or in a team environment. Proven ability to document system workflows. Manage project tasks to the project plan for multiple projects. Good time management and organization skills. Proven ability to prioritize multiple activities and objectives in a rapidly changing environment, and deliver quality service with minimal supervision. Interact with internal and enterprise staff in a professional, effective manner. Convey technical concepts and user needs to ‰ÛÏlay‰Û individuals, as well as communicate technical issues. High commitment to detail and accuracy. Support team members. Maintain a positive attitude and be willing to learn new skills. Maintain a high level of energy and creativity. Learn internal applications to provide high level of service. Degree is required or Equivalent Education/Experience. BA/BS is desired Primary Location: California-Greater Sacramento Area-Mather Organization: Sutter Health Information Services Employee Status: Regular Accepted Applications: All Candidate Applications Accepted Benefits: Yes Position Status: Non-Exempt Union: No Job Shift: Day Shift Hours- 8 Hour Shift Days of the Week Scheduled: Monday-Friday Schedule: Full Time Hours Per 2wk Pay Period: 80 All qualified applicants will receive consideration for employment without regard to race, color, creed, religion, marital status, sexual orientation, registered domestic partner status, sex, gender, gender identity, or expression, ancestry, national origin, age, medical condition, physical or mental disability, military or protected veteran status, political affiliation, pregnancy, childbirth or related medical condition, genetic information or any other characteristic made unlawful by local, state, or federal law, ordinance or regulation. External hires must pass a background check/drug screen. Qualified applicants with arrest and/or conviction records will be considered for employment in a manner consistent with Federal, state, and local laws, including but not limited to the San Francisco Fair Chance Ordinance."