"job_title","job_requirement"
"Senior Analyst, Host Intrusion Detection","The Senior Analyst, Host Intrusion Detection will work with a team of information security professionals who help protect Best Buys intellectual property and customer information. As part of the Security Operations team the Sr. Analyst will be responsible for supporting host intrusion detection systems within Best Buy. The successful candidate should have an understanding of system hardening best practices and general system administration on Windows and Linux platforms.
**This position is part of one of our after business hours teams**
Job Responsibilities:
Performing all Host Intrusion Detection Systems (HIDS) administration, design, and support duties in a diverse environment to ensure compliance objectives and additional security objectives are met
Configuring HIDS to monitor for security relevant changes to systems
Configuring baseline configuration standards within HIDS that match Best Buys hardening standards to monitor for baseline drift
Configuring HIDS to send logs to the SIEM and working with other security operations staff on interpreting events and setting proper alerts and thresholds
Create and optimize alerting, reporting, and dashboards for HIDS to monitor the health of the environment
Developing documentation for standard processes used to manage the HIDS environments
Basic Qualifications:
6+ months working with Windows and/or Linux platforms
6+ months working with incident management and security operations best practices
6+ months working with various scripting tools such as PowerShell
2+ years working in the information technology field
Preferred Qualifications:
Experience working in a Security Operations Center or similar environment
Completion of an Associate degree in an area such as Computer Science, Information Security, Information Technology or equivalent work experience
One or more of the following industry certifications: Security+, Network+, SSCP, GSEC"
"Senior Network Engineer - Security","Best Buy is not only a retailer, but also a technology-based company. Technology is the heart of our operation. Our Information Technology organization is transforming to play an integral role in defining and executing key elements of the business model.
Starting in 2004, Best Buy had historically operated its information technology functions in a largely outsourced structure. Best Buy maintained a small internal technology team focused on aligning the work of our outsourcing partners with business strategies.
Today, Best Buy has moved to a multidimensional IT model. We have expanded the internal teams and capabilities necessary to drive the IT strategy, architecture and technology solutions to support Best Buy's growth.
Our current IT environment is fast-paced and constantly changing to meet the demands of our diverse business offerings. We seek talented, motivated professionals with a sense of adventure, diversity of thought, and the combination of creativity and experience to make a difference.
Position:
The Senior Network Engineer serves as the point of contact for Network design, implementation and management assistance of all network environments. This position will focus on network security with specific attention to security platforms such as firewalls, proxies and web application firewall.
Responsibilities include:
- Design, implementation and integration of security architectures as required with other security technologies and network technologies; this could include retail locations, campus, and data centers. Examples include: standard port based firewall (routed and transparent), Next Generation firewalls, VPN platforms (IPSec & SSL) , proxy platforms and web application firewall (WAF) platforms
- Setting network standards and processes for Tier 1 and 2 staff
- Overall project delivery requiring network services with regard to security related initiatives.
- Escalation support for all network situations
- Vendor management
3rd party support vendors
Hardware vendors
- Collaboration with cross-functional teams to ensure alignment and resolve concerns
Expectations of the Sr. Network Engineer include
- Maintaining a working knowledge of security and network standards
- Building strong relationships with stakeholders- Performing as a consistent champion of process.
- Continually contributing toward the advancement of the engineering practice
- Growing domain knowledge of infrastructure services
- Demonstrating the Best Buy values ¦
Have Fun While Being the Best
Learn from Challenge & Change
Show Respect, Humility, & Integrity
Unleash the Power of our People
Basic Requirements:
7 years' experience in networking
3 or more years of experience in a Senior Network Engineer Role with responsibilities including the support of security hardware
Recent hands on experience with any of the following Cisco ASA firewall platforms, Next Generation Firewall platforms and/or configuring VPN technologies
Web Application Firewall experience (such as Citrix Netscaler, F5, Imperva)
Cisco Route/Switch platforms experience
Ability work on-call and alternative hour schedules when required
Preferred:
Bachelor's or advanced degree in IT, Computer Science, business or related field
3 or more years of experience managing partner and vendor relationships to achieve business outcomes
Prior experience in a global enterprise
Prior experience engineering networks with more than 2000 devices
Prior experience working with multiple data center and perimeter security environments
Prior experience with Load Balancers (Local & Global, Citrix and F5 preferred)
Prior experience with network monitoring and security products
Prior experience with Cisco technologies and solutions including but not limited to: Nexus 7000/6000/5000/2000, LAN controllers, fixed configuration switches, and Cisco ISR and ASR series routers
Prior experience with the DNS/DHCP"
"Senior Specialist, Cyber Security Investigations","What does a Senior Specialist, Cyber Security Investigations do?
This Senior Specialist position is a hands on role which serves as a technical lead responsible for the execution of the key components of the e-Discovery and Cyber Investigations program, including providing strategic vision, planning, technical expertise, and the execution of projects for Best Buy. The position is also responsible for providing guidance to the Litigation teams in their e-Discovery collection efforts, including overseeing the technical facilitation of litigation holds, assisting with early case assessment relative to data locations and technology capabilities, and ensuring data collections are consistent with records management guidelines.
Executing on projects involving the identification, collection, processing, review, and production of electronic data relevant to litigation or regulatory investigations
Lead multiple matters; play a visible, primary technical point of contact role and ensure direct accountability for matter success
Preserve evidence as it relates to Incident Investigation using sound evidentiary procedures
Perform timeline and root cause analysis and have the ability to present findings in a structured reporting format for use in court and/or presentation to management
Conduct digital media investigations. Examines hard drives, storage devices, cell phones or any electronic device that may hold evidence.
Performs a variety of forensic and electronic discovery services, including digital evidence preservation, forensic analysis, data recovery, electronic mail extraction, and database examination
Lead high level project/matter communication meetings and status updates; offer suggestions, solutions and recommendations
Enforce and perform rigorous quality control on all work product generated by the Cyber Security Investigation team
Identify areas for improvements to discovery and investigations, and initiate and implement related projects
Identify ways to leverage existing data; initiate and implement data projects across matters and teams
Engage in consultative and advisory role with Enterprise-partners in Legal, Finance, and Audit on technology-based solutions
Master technical knowledge of internal e-Discovery / forensic applications and other industry-standard technologies
Familiarity with network environments and system administration
Strong hardware and software troubleshooting experience
May be required to testify
What are the professional requirements of a Senior Specialist, Cyber Security Investigations?
Basic Qualifications:
Bachelors Degree in Information Assurance, Forensics, Criminal Justice, OR equivalent work experience
Preferred Qualifications:
Advanced knowledge of commonly used forensic and e-discovery products (e.g. Encase, FTK, Nuix, Cellebrite, etc.)
Industry Certifications such as ENCE, ENCEP, CEDS, GCFA, GCFE, CFCE, CFE
5 or more years of advanced application of technical skills
Advanced Degree or Certification in Information Assurance or Forensics
Experience with scripting and programming languages"
"Senior Web Engineer","The Best Buy e-commerce team is seeking innovative and technically curious Senior Web Engineers who want to make a huge impact in the digital evolution, building key e-commerce technology initiatives.
A career with BestBuy.com offers the opportunity to apply your talents and creative energy to deliver high performing solutions at one of the top 10 e-commerce sites in North America. There are multiple areas of specialization available such as Search, Distributed Services, Big Data platforms, Cloud, Infrastructure and more.
What you will do as a Senior Web Engineer
Work on the Customer 360 Domain Team. This is a critical e-commerce position where you can apply your talents and creative energy to deliver high-performing personalization at scale solutions at internet scale. The Customer 360 Domain Team drives the vision, strategy, customer experience and technical delivery for the ˜single view of a customer digital experience. You'll be called upon to lead agile teams including engineers, business and quality analysts.
Ideal Candidates Should Have
Experience in implementation and deployment of modern web development solutions: Java, Groovy, Spring, REST based web services, NoSQL databases
Demonstrated background working directly with engineers, product managers, and stakeholders
Creative and innovation-driven with the ability to articulate engineering design patterns related to scale, performance, security and usability
Experience in agile development methodology “ Scrum, Kanban and/or XP
Experience in test driven development, continuous integration and deployment practices
Persuasive written and oral communication skills
Passion for building top-quality products and services
Exceptional ability to collaborate effectively on cross-functional projects
Basic Qualifications
6+ years experience in enterprise application development with Bachelors degree; additional 2 years experience without BS/BA
1+ years experience mentoring junior developers
Preferred Qualifications
4+ years experience building e-commerce and / or web applications using Java, Spring and REST
Proficiency with UNIX/Linux command line
Hands-on development experience to include: Java, Ruby on Rails, Python, PHP
Unit testing, test-driven development or functional test automation
Experience developing for mobile/tablet form factors
Familiarity with front-end technologies
Experience using version control systems such as SVN or Git"