"jobs_title","jobs_requirement"
"Data Analyst – Marketing Data Team","Data Analyst – Marketing Data Team
Norwich
‘Come and join me leading the digital transformation of Aviva. We will fundamentally change the way consumers engage with our products and services.” This is a once in a lifetime opportunity to change an entire industry.’ –Andrew Brem (Chief Digital Officer)
Here at Aviva we are looking to transform the way in which we engage with our customers. Digital technology is at the core of this transformation with data and analytics at the heart of our strategy. The marketing data team manage the marketing database and we will be revolutionising we manage our data and deliver marketing campaigns. This is an exciting opportunity to join a fast growing team that is core to the digital strategy.
What will you need to do?
Become a subject matter expert understanding both our business and it’s data.
Get involved in core change activity including design, build and testing.
Work collaboratively with stakeholders to ensure data is fit for purpose for campaigns, reporting and analytics
Provide technical advice and support to our internal customers
Be able to interpret business problems and translate them into technical solutions and convey those solutions back to non technical stakeholders.
Be able to interrogate data to solve problems and get to the root cause of issues
Understand marketing database compliance with DPA and other relevant legislation.
Support the accurate delivery of marketing campaigns and analytics through the provision of investigative analysis and the on-going monitoring of key metrics and audit checks.
Work closely with on and off shore colleagues to ensure quality of deliverables and SLA’s are met.
Provide clear, concise communications to relevant stakeholders.
How will you do it?
You will be proactive with a strong ability to deliver change and improvement
You will have a can-do attitude
You will continually hone existing technical skills and develop new ones to further your reputation as a technical expert.
You will be self motivated with a desire to continually improve both yourself and
You will work collaboratively by nature; you will actively contribute your recommendations and take other’s on board for the benefit of the business and our customers
You will have a commercial and entrepreneurial mind-set and push your stakeholders both internally and externally to beat targets
You will have a high level of drive, energy and personal commitment to success
Key Skills
Experience in Analytics, Data, Development.
Experience in relational database management
Experience in analytics, CRM or database marketingSAS / SQL experience (Preferably Teradata) an advantage
.Net experience an advantage
Hadoop experience an advantage
Key interest in new technology and Big data
Data Interrogation and manipulation skills
Practical experience of using data and applying logic to solve business problems
Experience in dealing with large volumes of data sources from internal or external sources
Other Role Requirements
Strong attention to detail with a focus on accuracy and data quality
Excellent written, verbal and presentation skills
Ability to communicate technical problems and solutions to non-techincal stakeholders
Ability to package and present ideas with clarity
Good Customer, marketing and insight knowledge
Good understanding of the financial services sector with specific focus on insurance
We offer a competitive salary and fantastic benefits, including excellent pension and bonus potential, as well as generous annual leave.
We’re here to free people from the fear of uncertainty. Our insurance, savings and investment products help some 31 million customers enjoy life today, knowing that tomorrow is covered. And we definitely know how to look after our own people. If you love doing a great job to improve things for customers, you’ll be at home here. Help us build a future to be proud of and get ready to fulfil your potential with Aviva.
We prefer all application to be submitted online, however if you require an alternative method of applying please contact Jenny Dao in the resourcing team on 0207 662 0934."
"IT Care Service Bar Analyst","Role Description
IT Care Technical Service Specialist
IT Care at Aviva is an industry leading, award winning IT family, passionate about technology and supporting their colleagues to give them what they need, when they need it, to do their jobs.
We pride ourselves on employing incredible individuals, whose varied skills and strengths bring value to the team and are committed to constantly challenging themselves and each other.
We are currently looking for an IT Care Technical Service Specialist to join our dynamic Bristol Service Bar. The successful candidate will have amazing people skills, a love of solving problems and a genuine enthusiasm for new technologies. In IT Care we don’t just “accept” change; we invent it, we support it, and we celebrate it.
The IT Care Bristol Service bar is one of 5 Bars worldwide which offer a wide range of services. Based loosely on the concept of a Genius Bar, we provide a one-stop solution for any IT issue, from technical fixes and training on current Aviva hardware and software, to the launch of new technologies to the market. The role will be predominantly Service Bar based, but will include plenty of opportunities to support other IT Care teams both in Bristol, and across the UK.
On a day to day basis you will provide IT help and guidance to our Bristol based staff, you’ll use your charisma and IT Knowledge to ensure that every interaction at the Bristol Service Bar is a positive and useful one. You will also support the other IT Care teams across all sites when required.
Skills/knowledge:
Excellent customer service skills.
Strong, autonomous problem solving approach.
Experience in challenging process and delivering change.
Problem Solving including route cause analysis.
Ability to multi task and prioritise, in a busy working environment.
Windows 7, 10.
MS Office 365, including an in depth understanding of Outlook and its features.
Mobile device support (iPhone’s, iPad’s, Blackberries).
Mobility / VPN technologies.
Remote Desktop tool experience.
Windows zero configuration service + wireless.
Apple Mac and IOS Experience.
Audio Visual support.
Basic understanding of network protocols.
Desirable:
Industry knowledge of the Insurance sector.
We offer a competitive salary and fantastic benefits, including excellent pension and bonus potential, as well as generous annual leave.
We’re here to free people from the fear of uncertainty. Our insurance, savings and investment products help some 31 million customers enjoy life today, knowing that tomorrow is covered. And we definitely know how to look after our own people. If you love doing a great job to improve things for customers, you’ll be at home here. Help us build a future to be proud of and get ready to fulfil your potential with Aviva
Back to top"
"Head of Legal and Data Protection","Role Description
An exciting new opportunity has arisen within our UK Digital department. We are currently recruiting for a Head of Legal and Data Protection in London or York on a permanent basis.
The Background
UK Digital is positioned as a distribution business, with an aim to deliver innovative propositions, leading digital experience and sustainable long term profit growth. Our ambition is to build more direct relationships with customers, growing from 3.2m Direct customers today to 5-6m in 2020. We also aim to increase MyAviva registrations & usage from all channels from 1.2 to 8 million by end 2016.
The Team
You will be required to proactively manage and be accountable for the Legal and Data Protection team, ensuring the successful management of all resources within the agreed budget through optimal team structures, work allocation and development/ succession plans. You will also need to ensure the skills and knowledge of individuals within the team are utilised and developed, to build strong team engagement and performance, and to role model the Aviva values and leadership behaviours, as evidenced at the mid-year and full-year.
The Person
The role holder must have a unique balance of the Subject Matter Expertise on Legal and Data Protection but also the agility to work in a fast-paced, agile environment. The role holder will work with teams at the leading edge of digital innovation and will need to have strong conversations with creative stakeholders to get the balance between protecting Aviva and achieving UK Digital’s stretching ambitions. This role has a requirement to travel to other business centres in the UK.
Duties & Responsibilities
Collaborative working with digital and creative design teams.
Identification and routine oversight is undertaken in all key legal, data protection, regulatory and risk areas
Assist UK Digital in identifying breaches and issues and ensure remedial action is taken or that the risk is accepted at an appropriate level
Ensure appropriate action plans are in place to address other material legal and regulatory risks and ensure these plans are monitored
Provide first class guidance on and promote legal compliance, regulatory risk management and DPA compliance, covering a wide range of operational, regulatory and product matters.
Support in education and awareness campaigns, for the embedding of effective legal, regulatory compliance and provision of briefing on new developments
Ensure UK Digital responds appropriately to legal and regulatory change
Maintain effective relationships with the UK Digital Executive and Senior Management
Develop a first class highly motivated team of lawyers and data protection staff under management control
To actively manage external lawyers in accordance with the Supplier Protocol, with a view to using both internal and external resource flexibly in order to minimise expenditure on external suppliers.
Skills & Experience required
Qualifications
A solicitor, barrister or legal executive entitled to practice in the UK;
A good understanding of Data Protection regulation and the UK Digital business;
Recognised business, IT or accountancy qualification and/or;
Substantial experience of performing similar role.
Skills and Knowledge
Excellent technical knowledge of areas of law and regulation relevant to responsibilities
Expert understanding data protection in a FinTech organisation
Deep understanding of strategic/business issues and more specifically UK Digital strategy, structure, channels, high-level processes and issues
Excellent communication skills (written & oral) at all levels of the organisation (incl. Board / GE level communications)
Ability to lead a group-wide process involving IT and Digital professionals
Capable of working with international and virtual teams
Strong influencing/negotiating skills
Analytical & language skills
Issue identification skills
Problem-solving
People management
Technical leadership and ability to transfer knowledge to “upskill” teams through coaching.
Resilient to challenge at the most senior level whilst building & maintaining relationships
Self starter with innate ability to deal with conflict & solution resolution
Efficiency, performance management and improvement focus
Understand the needs of UK Digital customers
Risk management & controllership
Experience
Significant and varied experience at a senior management level
Good inter-personal skills and cultural awareness
Experience within insurance industry Proven track record of leading cross-business processes in a complex multinational group
Experience of influencing at senior management and executive level
Proven ability to manage a portfolio of major projects, negotiations and relationships with third parties and external advisers
Proven ability in people management
Back to top"
"Senior Solution Designer","Role Description
Aviva is revolutionising insurance and we want you to be at the forefront of it.
You’ll be joining Aviva at a really exciting time. Come and be part of building great new innovative ways to engage with new and existing customers, on a portfolio of products that reach out to 17 million customers. It’s never been more important for us to hire fantastic people who will sit at the forefront of delivering our strategy.
Digital First is our strategy at Aviva and this provides many exciting opportunities for you to play a key role in a range of high profile, technology-enabled projects. You will have a broad technical background and previous experience in lead roles on major application development or systems integration projects. You will also have a proven track record in designing and delivering scalable, robust and secure enterprise solutions. With first class customer facing skills and a genuine passion for quality / professional delivery, you will be looking for a new challenge with a company that genuinely recognises and rewards its star performers.
We approach software delivery with an agile mind-set, focused on delivering small, value driven enhancements often. We achieve that with our scrum teams that include developers, testers, business analysts and solution designers to create brand new experiences, small changes to existing products as well as investing in maintaining our existing products to improve code quality against our core development principles.
We are looking for Senior Solution Designers to work within our scrum teams to build, test, maintain, change and further evolve both existing and new products. You will bring a strong understanding of what modern technology can offer and will lead your team in adoption of new tools and techniques.
You’ll be responsible for:
Development of End to End Solution Designs to meet business objectives.
Ensuring that solutions adhere to architectural, security and quality standards.
Production of solution design artefacts to support the needs of project delivery.
Acting as point of contact to ensure all parties (including internal and external technical / development teams) understand the solution design and the part that they need to play within it.
Identifying risks affecting solutions, including mitigating recommendations and support in managing those risks.
We’re particularly interested in:
End to end project experience
Practical experience of working in an agile delivery approach
Experience of working on End to End technical solutions that encompass many systems and teams, drawing out the Key Design Decisions and their implications and resolving them
A broad technical background with depth in at least one architecture discipline
Strong interpersonal skills with the ability to communicate effectively at senior levels
A good knowledge of integration technologies including SOA
Practical experience of software development
Proven ability to interpret business requirements and design solutions based on those requirements
First class design skills including the ability to draw up extremely accurate specifications that could be effectively utilised by development team
Digital is our future. If you have the talent, the right skills, are inspired by innovation and cutting-edge technology, then we’d love you to join us. Apply now! We prefer all applications to be submitted online, however if you require an alternative method of applying please contact Jenny Dao in the Resourcing team on 0207 662 0394.
Back to top"
"Business Analyst","Role Description
We are actively recruiting for a Business Analyst on a 6 month fixed term contract. You are required to support of a key Commercial Pricing project for the General Insurance Company in Aviva.
Role Responsibilities
Liaise with customer counterparts and actively drive out customer requirements
Create and maintain specifications (business requirements, functional requirement, etc…)
Focus on quality of BA deliverables
Provide industry expertise / advice to clients, project delivery teams, sales teams
Conduct workshops, system demonstrations and presentations
Undertake peer reviews of specifications
Assist in the preparation of BA estimates & plans
Conduct specification walkthroughs (for other project delivery teams)
Assist and participate in the specification sign-off process
Provide support to the various project delivery teams (development, QA, UAT etc.)
Assist in solution architecture & design
Assist with client and project delivery team training
Participate in project team meetings
Participate in the triage of defects
Participate in defect resolution
Daily reporting of BA progress
Skills/Knowledge
Previous experienced in Commercial Insurance within the General Insurance industry
Meticulous attention to detail and a high degree of accuracy
Excellent communication skills, both verbal and written
Aviva product knowledge in particular Commercial – Property and Liability Insurance
Aviva systems knowledge and understanding - in particular Polaris and BPS
Experienced in business analysis processes and methodologies
Experience in JIRA
Good knowledge of project management work practices
Ability to integrate business and technology solutions of both
We prefer all applications to be submitted online, however if you require an alternative method of applying please contact Saima in the Resourcing team on 0121 779 1449.
Back to top"
"Senior Business Analyst","Role Description
'Come and join me leading the digital transformation of Aviva. We will fundamentally change the way consumers engage with our products and services. This is a once in a lifetime opportunity to change an entire industry.' - Andrew Brem - Aviva Chief Digital Officer
We are currently recruiting for a Senior Digital Business Analyst to be responsible for the development and on going definition of viable business requirements, (user stories/acceptance criteria) and non functional requirements to support Aviva’s ambition Digital plans. Our Senior Digital Business Analyst play a key role within the Agile feature/platform team to ensure the expected business outcomes are delivered. They will also be required to lead and develop other Business Analysts providing coaching and mentoring when needed.
Our Senior Digital Business Analyst will ensure business goals are understood and requirements/user stories/acceptance criteria are documented in conjunction with Product Owners, to enable solutions to be defined by the scrum team. The Analyst will work collaboratively with design/development /test colleagues in order to ensure that solutions address the requirements of the business. You will also Champion and make wider contributions to the Digital team through your knowledge from other IT&C change practices.
The Successful candidate will have a detailed knowledge of creating Epics/User Stories/Requirements Definition/Acceptance Criteria using Agile tools and techniques, Behaviour Driven Development (BDD) as well as Business Analysis tools and techniques. You will have experience working with full scale scrum or Kanban, and be a competent user of Jira and Confluence.
You will have an understanding of the financial services industry and the legislation frameworks governing it. You will also possess excellent communication and stakeholder management skills.
We offer a competitive salary and fantastic benefits, including excellent pension and bonus potential, as well as generous annual leave.
We’re here to free people from the fear of uncertainty. Our insurance, savings and investment products help some 31 million customers enjoy life today, knowing that tomorrow is covered. And we definitely know how to look after our own people. If you love doing a great job to improve things for customers, you’ll be at home here. Help us build a future to be proud of and get ready to fulfil your potential with Aviva.
We prefer all applications to be submitted online, however if you require an alternative method of applying please contact Jenny Dao in the Resourcing team on 0207 662 0394.
Back to top"
"IT Delivery Manager","Role Description
Within Aviva Digital we approach software delivery with an Agile mind-set, focused on delivering , value driven enhancements often. We achieve that with our scrum teams that include Developers, Testers, BAs and Solution Designers to:
Create brand new experiences
Change existing products
Investing in maintaining our existing products to improve code quality against our core development principles.
The successful candidate will be the IT Delivery Lead for our Integration, APIs and Security team. Structurally, this is a management team role within the Integration, APIs and Security team, who are responsible for :
Maintaining the RESTful APIs estate that underpins both ours and our partners’ digital apps.
Changes to eSecurity across Aviva
You will be tasked with transforming our Release, Quality and Agile maturity, working with the community to refine and execute our plans in a collaborative way.
You`ll need to be equally comfortable talking strategically with the leadership team and delving into functional details. We`re looking for someone who is passionate about doing the right thing, proactive enough to explore new opportunities and inspiring enough to take others on the journey with you.
You will have good judgement and the ability to lead your area in a collaborative way, taking on board the views of your many stakeholders.
What you’ll do in more detail
You’ll be responsible for:
Improving our Agile Maturity across the department and with our Product Owners. Areas of focus will include:
Establishing and running our Scrum of Scrums
Measuring and improving business and team Satisfaction
Improving consistency in how we run our teams, and facilitating shared learning across the teams.
Reducing time to market while improving quality and predictability.
Management of dependencies on other teams.
Establishing distributed agile as we expand internationally.
Leading our Quality agenda including, but not limited to, transforming our approach to functional and non functional test automation.
Leading the evolution of our Release Management approach. Including implementation planning, deployment processes and the management of our configuration management team
Stakeholder management
Line and talent management of our scrum master community, managing the relationships with our assurance and release management leads.
You’ll achieve this by:
Being an exceptional, collaborative worker who balances business needs and requirements with a passion for acting as a member of the wider team
You'll have excellent communication skills, with the ability to speak confidently to all levels of seniority
You'll have demonstrable experience in a related role and experience as a Agile Coach/Leader ideally within a similar area
You will have a thorough understanding of agile principles and an overview of different methodologies, (Scrum, Lean, Kanban)
We’re particularly interested in:
Hands on experience of being an Agile Coach within a distributed agile environment
Experience of working with geographically dispersed teams
Negotiating, influencing, effectively challenging and gaining commitment
Assessing the impact of a broad set of initiatives along with excellent dependency management
Additional Information
We offer a competitive salary and fantastic benefits, including excellent pension and bonus potential, as well as generous annual leave.
We’re here to free people from the fear of uncertainty. Our insurance, savings and investment products help some 31 million customers enjoy life today, knowing that tomorrow is covered. And we definitely know how to look after our own people. If you love doing a great job to improve things for customers, you’ll be at home here. Help us build a future to be proud of and get ready to fulfil your potential with Aviva.
We prefer all applications to be submitted online, however if you require an alternative method of applying please contact Jenny Dao in the Resourcing team on 020 7662 0394.
Back to top"
