"jobs_title","jobs_requirement"
"Digital Software Engineer - Front End Development","Role Description
Digital Software Engineer – Front End Development
Aviva is revolutionising insurance and we want you to be at the forefront of it.
You’ll be joining Aviva at a really exciting time. We would love you to be a part of building great new innovative ways to engage with new and existing customers, on a portfolio of products that reach out to 17 million customers. It’s never been more important for us to hire fantastic people into our awesome digital teams who sit at the forefront of delivering our strategy. Our scrum team’s work across a range of products such as Home, Motor and Travel insurance bringing in a combined £122m GWP and Breakdown insurance, pensions, retirement planning, protection and health. We are looking for an enthusiastic, energetic person who is passionate about all things web and new technology. You'll be exposed to challenges that typically involve translating creative visions into beautiful implementations and to work closely with a highly skilled team to produce the best solutions possible. We want to speak to you if you are interested in working for a leading company, helping to drive forward the development of its websites. You will need to be confident taking design concepts through to delivery and fruition.
We have also created the award winning customer portal; MyAviva which allows our customers to access and maintain their Aviva policies. MyAviva has been so successful it’s now a global platform which we hare currently launching in France and coming soon to Italy, Canada and Singapore. And if that’s not enough we develop all of our mobile apps too!
Aviva were also awarded Digital Insurance Company of the year 2014 at the Data, Analytics & Technology Awards for Insurance.
Within Aviva Digital we approach software delivery with an Agile mind-set, focused on delivering small, frequent, value driven enhancements. We achieve this with our scrum teams; which include developers, testers, BAs and Solution Designer; to create brand new experiences, small changes to existing products as well as investing in maintaining our existing products to improve code quality against our core development principles.
We are looking for a Front End Engineer to join the Digital Engineering Team within our organisation. Candidates require a strong understanding of HTML, CSS, Javascript, Photoshop and Git. Experience with producing accessible and responsive layouts using HTML5/CSS3 will be needed.
You concentrate on building working software
When the code leaves development it is production ready
If you change code you only ever make it better: Ratchet
SOLID/KISS principles are followed
Keep re-use at the forefront of your mind
Frequently deliver high value features to our customers
Focus on building great stuff
What you’ll do in more detail
Expert and hands on knowledge of HTML5 with a passion for semantics
Expert in the latest CSS standards
Practical experience of working using responsive design techniques
Advanced JavaScript skills
A good level of understanding of Git
Evidenced working knowledge of accessibility and the ability to assess sites against it including working to standards such as WCAG
A passion for problem solving
Documentation writing skills
Task management
Excellent communication skills
A strong portfolio of sites developed by you demonstrating the breadth of your skills
Desirable Knowledge & Skills
Photoshop skills
Java/JSP
Knowledge of site performance and optimisation
Experience with Adobe Sitecatalyst and Target products
We offer a competitive salary and fantastic benefits, including excellent pension and bonus potential, as well as generous annual leave.
We’re here to free people from the fear of uncertainty. Our insurance, savings and investment products help some 31 million customers enjoy life today, knowing that tomorrow is covered. And we definitely know how to look after our own people. If you love doing a great job to improve things for customers, you’ll be at home here. Help us build a future to be proud of and get ready to fulfil your potential with Aviva.
We prefer applications to be submitted online, however if you require alternaitve method of applying please contact Jenny Dao in the resourcing team on 020 7662 0394.
Back to top"
"Lead Solution Designer","Role Description
Aviva is revolutionising insurance and we want you to be at the forefront of it.
You’ll be joining Aviva at a really exciting time. Come and be part of building great new innovative ways to engage with new and existing customers, on a portfolio of products that reach out to 17 million customers. It’s never been more important for us to hire fantastic people who will sit at the forefront of delivering our strategy.
Digital First is our strategy at Aviva and this provides many exciting opportunities for you to play a key role in a range of high profile, technology-enabled projects. You will have a broad technical background and previous experience in lead roles on major application development or systems integration projects. You will also have a proven track record in designing and delivering scalable, robust and secure enterprise solutions. With first class customer facing skills and a genuine passion for quality / professional delivery, you will be looking for a new challenge with a company that genuinely recognises and rewards its star performers.
We approach software delivery with an agile mind-set, focused on delivering small, value driven enhancements often. We achieve that with our scrum teams that include developers, testers, business analysts and solution designers to create brand new experiences, small changes to existing products as well as investing in maintaining our existing products to improve code quality against our core development principles.
We are looking for a Lead Solution Designer to shape, lead and govern all design work across a number of our scrum teams. You will bring a strong understanding of what modern technology can offer and will lead your team in adoption of new tools and techniques.
Digital is our future. If you have the talent, the right skills, are inspired by innovation and cutting-edge technology, then we’d love you to join us. Apply now!
You’ll be responsible for:
Leading a team of designers working on a portfolio of change projects.
Engagement with business stakeholders when ideas are conceived; and lead in shaping them into deliverable projects.
Development of End to End Solution Designs to meet business objectives.
Governance and approval of all designs to ensure adherence to architectural, security and quality standards.
Production of solution design artefacts to support the needs of the project delivery.
Acting as point of contact to ensure all parties (including internal and external technical / development teams) understand the solution design and the part that they need to play within it.
Identifying technical risks affecting solutions for Aviva Health, including mitigating recommendations and support in managing those risks.
Continuous improvement of the way Solution Design is performed.
We’re particularly interested in:
Experience of working on end to end technical solutions that encompass many systems and teams, drawing out the Key Design Decisions and their implications and resolving them
Experience of ownership and governance of large and complex end to end technical solutions
Practical experience of working in an agile delivery approach
A broad technical background with depth in at least one architecture discipline
A good knowledge of integration technologies including SOA
Practical experience of software development
Proven ability to shape business requirements and design solutions based on those requirements
First class design skills including the ability to draw up extremely accurate specifications that could be effectively utilised by development team
Strong interpersonal skills with the ability to communicate effectively at very senior levels
Experience of leading fellow technical professionals, especially coaching and mentoring of colleagues to achieve delivery outcomes.
This is a full time, permanent position based in our offices in Noriwch. If you feel you have the right level of technical knowledge as well as a highly customer focused attitude, this could be the ideal role for you. Don’t miss out on this opportunity, apply now!
We prefer all applications to be submitted online, however if you require an alternative method of applying please contact Jenny Dao in the Resourcing team on 0207 662 0394.
Back to top"
"Head of Functions IT – Finance and Risk","Role Description
We have an exciting opportunity for a Head of Functions IT – Finance and Risk to be based in London.
Your role is to provide leadership and management of all aspects of Group Finance and Actuarial systems ensuring Aviva has access to compliant and well governed systems that enable finance policy and strategy.
Reporting to the Director of Aviva Group Centre and Group Functions IT you’ll ensure there is a clear strategy for the future development and continuous improvement of the Group Finance and Actuarial systems landscape which aligns with the wider finance and IT priorities.
You’ll have 5 – 6 direct reports, total team size c. 30 plus 3rd party supplier resource as required. Key Internal and External relationships will include: Senior Group Finance Leadership Team including the Finance Exec, CTO & CISO peers, Software Suppliers; Microsoft, SAP, TCS, IBM and CSC/AWS Cloud.
Accountabilities:
Group Finance and Actuarial Systems Strategy
Lead the engagement with Senior Finance colleagues in order to understand the Finance strategy and priorities that influence Group Finance and Actuarial systems.
Develop and define appropriate long term strategies (3yrs +) and tactical plans (1 yr. rolling) for Group Finance and Actuarial systems that enable Finance priorities to be met.
Maintain and execute tactical plans and continuous improvement for Finance Systems a controlled ‘Book of Work’ process that is transparent and agreed with Finance.
Service Management
Accountable for teams (Aviva and 3rd parties) providing a high quality services and meeting service targets, Service agreements and third party SLA’s within remit (as defined in Service guide)
Responsible for production, test and development platform management for the application.
Overseeing the Incident management process
Developing policies as requirement needs
Constantly striving to deliver operational efficiencies to reduce overheads and deliver enhanced services.
Communicating with all stakeholders
Change Delivery/Development Management
Development of an annual book of work in support of the Systems Strategy and customer needs.
Setting up and resourcing of projects, engaging in the steering as required.
Compliance with project gating and GEIC processes.
Driving and agile/feature team resourcing and delivery model.
Management of third party supplier delivery
Project reporting/delivery monitoring and issue escalation/management as required.
Supplier Management
Manage the end to end relationship with a portfolio of selected Software and Consultancy suppliers;
Ensuring contractual obligations and performance levels are met e.g. system availability, security standards adherence
To drive maximum value and return for Aviva’s spend
To influence the suppliers strategic roadmap to align with Aviva’s needs
Ensure internal supplier framework standards are met at all times e.g. Ariba
To act as Aviva’s escalation point in the event of supplier conflict
Lead the tender, selection and / or commercial negotiation process for Group Finance and Actuarial systems suppliers when necessary (either new requirements or existing contractual agreements conclude).
Group Finance and Actuarial System Support
Provide all employees with a high quality and efficient ‘second tier’ support service for Group Finance and Actuarial systems.
Provide Finance teams (market and group) with expert advice and issue resolution relating to complex or new Group Finance and Actuarial system functionality.
Support the deployment of Group Finance and Actuarial systems functionality to enable the annual Finance cycle e.g. full Year and Half Year reporting.
Audit & Governance
Accountable for Group Finance and Actuarial systems meeting known regulatory requirements in each of the markets Aviva has an employee presence.
Compliance and collaboration with Risk & CISO functions to ensure Group Finance and Actuarial systems meet defined internal policies and standards
Govern all aspects of systems change across the Group Finance and Actuarial systems estate ensuring suitable controls are in place to safeguard system integrity and stability.
Manage all associated employee and supplier budgets c. £4m total
Team Leadership & Development
Leadership responsibilities for a team of up to 30 people (C – E Grades) including line management of 5 or 6 direct reports, plus supplier resources as workloads and projects dictate
Accountable for team motivation and engagement as measured by the annual ‘Voice of Aviva’ survey
Ensure team resourcing levels and model (internal vs 3rd party) are appropriate to deliver defined book or work and strategy
Ensure team development plans are in place and aligned with Aviva’s Group Finance and Actuarial Systems plans and supplier roadmaps
Essential Skills and Knowledge:
Professional IT and / or Finance qualification preferred
Experience of managing large scale IT supplier relationships and commercials – including of a Saas nature
Experience of governing end to end systems change / release within a complex environment
Experience operating at a management level within a Finance Systems role for a global organisation
Experience of stakeholder management to senior levels in a large organisation – ideally within the Finance function
Experience leading a technical / semi technical IT team, ideally across split sites / countries
Ability to define and articulate system strategy that aligns to business drivers / goals
Aware and engaged with external best practice and trends within Finance Information Systems
Sound understanding of Software as a Service (SaaS) principles (benefits / constraints)
Good operational understanding of Finance policy and practice
Understanding of system availability, continuity and security principles and practices
We prefer all applications to be submitted online, however if you require an alternative method of applying please contact Dawn Rudrum in the Resourcing team on 01603 680851. (strictly no agencies)
Back to top"
"Solutions Architect","Role Description
An exciting new opportunity has arisen for a Solutions Architect on a permanent basis located at either our Bristol or York office.
The Background
We help our 34 million customers save for the future and manage the risks of everyday life, with strong businesses in 16 markets in the UK, Europe, Asia and Canada. Aviva Life is the UK's leading life and pensions business, providing award-winning retirement, savings and protection business to 12 million customers
Our overarching purpose is to free people from the fear of uncertainty and we have a clear strategy to deliver our investment thesis of cash flow plus growth by always putting our customers first. Our strategic anchor is the “what we do, how we do it and where we do it” of our strategy:
We are a True Customer Composite– meeting all customer needs across life, general, accident and health and asset management. We put Digital First because this is increasingly how our customers want to deal with us. We are Not Everywhere but focus on a select number of markets where we can win.
Our values – care more, kill complexity, never rest and create legacy – are at the heart of how we do business.
Our strategy and values have served us well as we turned around Aviva and will continue to guide us as we move to a new phase – transforming and growing the business for our customers and stakeholders.
IT is central to our business and the Strategy and Architecture team plays a pivotal role. The team work with key stakeholders across business areas and markets to help in enabling Aviva to deliver its outcomes and driving our business ambition.
The Person
Aviva Life is seeking an experienced Solution Architect to join the UK Life Strategy and Architecture team.
The role holder will operate in the Life business and as a part of the Global Strategy & Architecture practice. The role supports, enhances and promotes the value and delivery of architecture across the organisation. They will provide support to the Strategy & Architecture leadership team by providing strategic direction in one or more system/technology domains via IT visions and underpinning strategies and transformational roadmaps.
Accountable for providing strategic context, direction, roadmaps and standards, you will be supporting the setting of direction and the governance of the delivery of IT solutions, aligned to the IT strategy, within Aviva Life
You will work with a range of senior stakeholders from Aviva and partner organisations, sharing knowledge, decisions, patterns and lessons learnt to improve productivity and enhance capability.
The role is based in York or Bristol, although travel to other locations will be required.
Duties & Responsibilities
The development and maintenance of domain specific IT technology roadmaps in line with the business imperatives of the organisation
Supporting the articulation of IT investments and decisions required to implement the Business and IT strategy
Develop target (solution) architectures specific to major projects/programmes for use by solutions designers (both internal and external to Aviva)
Contribute to the architectural assessment of change portfolios across one or more domains to support deliver of the IT Strategy
Govern change activities to drive alignment to overall strategic direction and ensure the integrity of the solutions from functional, service and compliance perspectives.
The identification of new technologies and IT capabilities, and their benefits and value to the business
The monitoring of Aviva’s competitors’ use of IT, to include analysis of any implications, and the recommendation of changes to Aviva’s IT Strategy.
Skills & Experience required
Degree or professional qualifications and/or equivalent Solution Design or Solution Architecture experience.
Related business and IT experience
A proven record of thinking through, leading and delivering high quality IT solutions which can be used to communicate with senior stakeholders.
Sound business and technology knowledge with commercial awareness and an understanding of Financial services markets, customers and technologies (experience within the Insurance industry would be an advantage but is not essential)
A background in business and technology across the delivery lifecycle (examples may include solution design, roadmaps, investment submissions, governance or business and data analysis)
Knowledge and active use of industry frameworks and tools would be beneficial (e.g. TOGAF, Zachman, Abacus, etc.)
Asset and Inventory Management
Emerging Technology Monitoring and Research
Solution Architecture
Customer Focus
Risk Awareness
Business and Financial Acumen
Execution
Strategic Thinking and Planning
Self Development
Strong communications and relationship management skills.
Demonstrates good analytical disciplined approach as well as a dynamic, abstract problem solving skills
Additional Information
We prefer all applications to be submitted online, however if you require an alternative method of applying please contact Nikita Hathlia in the Resourcing team on 07885823561.
Back to top"
"Business Analyst","Role Description
A fantastic new opportunity has arisen in the Dublin office. We are actively recruiting for a Business Analyst on a fixed term basis, initially on a 7 month contract. You are required to support a number of key enablement projects for the General Insurance Company in Aviva.
Role Responsibilities include
Liaise with customer counterparts and actively drive out customer requirements
Provide industry expertise / advice to clients, project delivery teams, sales teams
Conduct workshops, system demonstrations and presentations
Undertake peer reviews of specifications/stories
Assist in the preparation of BA estimates & plans
Conduct requirements walkthroughs (for other project delivery teams)
Assist and participate in the specification sign-off process
Provide support to the various project/tactical change delivery teams (development, QA, UAT etc..)
Assist in solution architecture & design
Participate in project team meetings/daily standups
Participate in the triage of defects
Participate in defect resolution
Regular reporting of BA progress
Focus on quality of BA deliverables
Skills and Knowledge:
Previous experienced in the General Insurance industry.
General Insurance product knowledge in particular Personal Lines – Private Motor, Home
Experienced in business analysis processes and methodologies – both Agile & Waterfall
Meticulous attention to detail and a high degree of accuracy
Excellent communication skills, both verbal and written
Good knowledge of project management work practices
Experienced in MS Word and MS Excel
Ability to integrate business and technology solutions of both
We prefer all applications to be submitted online, however if you require an alternative method of applying please contact Saima in the Resourcing team on 0121 779 1449.
Back to top"
"Cyber Operations","Role Description
This role is aligned to the UK CISO function and will be working within the wider Global CISO business unit, suppliers and business teams to support UK business lines in achieving and maintaining compliance to technical policy requirements. You will be part of a dedicated team that supports Aviva UK in achieving its objectives via the proactive and reactive identification, analysis and remediation of security threats and vulnerabilities in both the Aviva and Supplier owned/operated environments.
Leveraging services provided by the Global CISO function and those developed within UK team, candidates should be able to demonstrate a strong ability to analyse large amounts of data (using technology and manually) to identify security risks, prioritise and recommend remediation activities, build management information and provide commentary relating to business unit objectives and risk profile.
This role can be based either from the Bristol office, or working from home with two days per week in the Bristol office.
Duties & Responsibilities
Support requirement for all UK systems and platforms are monitored appropriately by the GSOC, managing interaction with the team from an UK CISO perspective and ensuring rapid remediation of vulnerabilities and issues on the UK CISO estate
Working to the UK policies & technical standards support the identification and remediation of security threats and vulnerabilities
Support the management of security incidents (response & remediation)
Contribute towards the development of protocols and procedures relating to Incident response, remediation and reporting
Identify requirement and support delivery of technical and non-technical preventative and detective controls
Establish and mature relationships with all necessary security and business stakeholders within the UK in order to ensure the security risk picture is well understood and managed effectively
Take an active role with regards to the evangelisation of security concepts across the UK business
Skills & Experience required
Preferably CISSP/ CISM qualified or relevant degree or experience
Solid knowledge of security management concepts
Knowledge of IS governance processes and practices, including ISMS monitoring and control frameworks such as ISO, ISF and COBIT, their relationship to other frameworks (ITIL, CMMI etc
Strong experience of IS incident management processes
Good understanding of security architecture principles and processes
Good knowledge of IT Operations procedures and best practices
Control design experience
Good stakeholder management
Excellent influencing, negotiating and communication (written and verbal) skills.
Disciplined and organised mind-set with a good attention to detail
Excellent time management skills, including the ability to manage a demanding and variable workload with tight deadlines
What will you get from this role?
Salary of £35000-£42000
Annual performance related pay review and bonus
Defined contribution pension scheme
Generous holiday allowance
Excellent flexi-benefits package
The Bristol site includes free parking, free bus service to and from Bristol City Centre, restaurant, fully equipped gym, W.H. Smiths and a cash point
Additional Information
We prefer all applications to be submitted online, however if you require an alternative method of applying please contact Kate Ridout in the Resourcing team on 0117 928 3382.
Back to top"
