"title","requirement"
"AVP / Senior Associate, Production Support Analyst, Core Systems Technology, Technology and Operations","Business Function Group Technology and Operations (T&O) enables and empowers the bank with an efficient, nimble and resilient infrastructure through a strategic focus on productivity, quality & control, technology, people capability and innovation. In Group T&O, we manage the majority of the Bank's operational processes and inspire to delight our business partners through our multiple banking delivery channels. Responsibilities End to End Handing of Finacle application production issues from ticket assignment including Issues analysis, Code fix, SIT Testing, UAT Test planning (Scope , duration),UAT support for user, Source promotion to production. Document process and reporting(xls, pivoting, ppt, swimlanes, etc) Monitor, track, and Managing and own release processes into production. Managing & Guiding the team members Managing critical issues (managing reporting, escalations, fixes) Manage communication for Major Incidents (SLA breaches, Application Major Incidents, Logistics issue) and responsible for communications with senior management Manage/coordinate recurring issues and ensure long-term resolution through proper Incident and Problem Management Act as a facilitator and coordinate between various teams like Infrastructure, development team to resolve, analysis of root cause for complex issues and outages Strong stakeholder management skills with main focus on continuous service improvement, consistent delivery and stability of production. Establish required process for transfer of production support work to offshore in a risk mitigated manner. Requirements An undergraduate degree or higher 10+ years experience in the Banking industry with 5+ years in Run-the-Bank (RTB) lead role with a proven track record of working in core banking environment Experience in Finacle application in code development and fixes(Finacle scripting, product, JRXML, Reports, etc) Previous experience with a good understanding of RDBMS / Unix / Large banking application. Strong team player, effective at communicating internationally and used to working closely with remote teams. Good knowledge of infrastructure technologies used, with focus on AIX/Oracle/Java Solid understanding of BAU support, incident, problem management processes as well as escalation management across a diversified environment Understanding of Risk Management, Disaster Recovery, Business Continuity, IT Security Architecture, and IT Regulatory Compliance. Present facts and recommendations effectively in oral and written form Pro-active, independent, resourceful and able to work in a team Willing to travel on short overseas business assignments High attention to detail Technology Requirements Production support Experience on Core Banking platform Software Configuration Mgmt, Quality Control Mgmt, Version Control Mgmt Operating System - AIX / Linux / Windows Database – Oracle / PL/SQL Application Servers – IBM Websphere Middleware technology – MQ, File transfers Apply Now We offer a competitive salary and benefits package and the professional advantages of a dynamic environment that supports your development and recognises your achievements."
"Analyst, Wealth Management Ops (Asset Static Team), Consumer Banking Tech, Technology and Operations","Business Function Group Technology and Operations (T&O) enables and empowers the bank with an efficient, nimble and resilient infrastructure through a strategic focus on productivity, quality & control, technology, people capability and innovation. In Group T&O, we manage the majority of the Bank's operational processes and inspire to delight our business partners through our multiple banking delivery channels. Responsibilities Creation, modification of new asset for Singapore and Hong Kong business unit. Enriching lean asset created by IA for new order placement. Input trade details found in termsheet into Avaloq. Escalate any trade details discrepancy found in termsheet to AI. Updating Financial Quantum (FQ) of asset for PB Credit. Attending queries from Marketing, IA, BMS and PBO team in Singapore and Hong Kong offices. Update and Verify – Risk Rating, AI/PI status, Basel and Country Risk Confirming tasks are done as per documented SOP Attending queries from Marketing, IA, BMS and PBO team in Singapore and Hong Kong offices Performing random check on prices uploaded by HK MTM team. Preparing back-to-back termsheet received from our counterparty/IA and to adhere to SOP. Re-format and uploading of term sheet for client documentation Creation of Counterparty, Custodian Account and Settlement Instruction in Avaloq Performing daily task for accumulator (daily accrual and barrier observation). Perform UAT. Dual Maker and Checker role for creation, modification of assets Requirements At least 2 years experience in a Private banking and wealth management environment in the backend operation. Knowledge in Investment products (i.e. Equites/bonds/mutual funds/ Structured Product) Functional knowledge/experience in back office support is required Able to Multi-Task, a Good team player, Self Motivated with good interpersonal skill Meticulous, alert & have an eye for figures & details. Good work Knowledge of MS Office applications especially MS Word and MS Excel. Minimum Diploma in Banking/Business or other related courses. Degree in other related course of studies is also welcomed. Apply Now We offer a competitive salary and benefits package and the professional advantages of a dynamic environment that supports your development and recognises your achievements."
"VP / AVP, Applications Development Manager (Trade Finance), IBG Technology, Technology and Operations","Business Function Group Technology and Operations (T&O) enables and empowers the bank with an efficient, nimble and resilient infrastructure through a strategic focus on productivity, quality & control, technology, people capability and innovation. In Group T&O, we manage the majority of the Bank's operational processes and inspire to delight our business partners through our multiple banking delivery channels. Responsibilities Manage and Lead a team of developers in design and development activities and guide technical direction To perform requirement analysis and propose designs and alternatives accordingly to meet bank’s application design architecture - to ensure system modularization, reusability and optimization.. Able to identify design flaws and drive resolution. Expected to communicate and bridge between business users, various tech teams, application vendors and development teams. Lead the developers in translating business requirements/user stories into Deliverables (FSD, Sprints) and drive application development from conceptual to testing to deployment. Lead in the development of Test Plan (Test Scenarios/Test Cases/Test data) and to perform technical/ functional testing to ensure requirements are well met. Manage the SIT and UAT of developed programmes with users. Manage and mitigate test issues and risk. Lead in performing analysis and troubleshooting of defects during testing. To lead and manage projects using both Agile and Waterfall methodology Requirements Qualified professional with a University degree or equivalent Degree in Computing / Computer Science / Engineering preferred. Certified Agile Scrum Master is preferred For AVP: Minimum 8 years of experience in Financial Services industry For VP: Minimum 12 years of experience in Financial Services industry Relevant knowledge and experience with the trade financing and trade applications is preferred. Analytical, solution oriented, and able to propose and follow through both transformational and incremental change Excellent interpersonal skills are required to work within the department, across the broader T&O department, with business partners and with vendors. Strong communication skills, able to communicate effectively at all levels, and both internally and externally. Concise and precise thinking essential Technical hands on experience and work on the various development languages and platforms like Java/J2EE, WebSphere, JBoss, SQL, Oracle, RBMS, MariaDB, IBM CICS, Cobol. Experience in building new application systems will be advantageous. Good working knowledge in UNIX/Linux/Windows Platform Good knowledge and programming/supporting experience of IMEX would be advantageous Apply Now We offer a competitive salary and benefits package and the professional advantages of a dynamic environment that supports your development and recognises your achievements."
"VP / AVP, Applications Development Manager (Trade Finance), IBG Technology, Technology and Operations","Business Function Group Technology and Operations (T&O) enables and empowers the bank with an efficient, nimble and resilient infrastructure through a strategic focus on productivity, quality & control, technology, people capability and innovation. In Group T&O, we manage the majority of the Bank's operational processes and inspire to delight our business partners through our multiple banking delivery channels. Responsibilities Manage and Lead a team of developers in design and development activities and guide technical direction To perform requirement analysis and propose designs and alternatives accordingly to meet bank’s application design architecture - to ensure system modularization, reusability and optimization.. Able to identify design flaws and drive resolution. Expected to communicate and bridge between business users, various tech teams, application vendors and development teams. Lead the developers in translating business requirements/user stories into Deliverables (FSD, Sprints) and drive application development from conceptual to testing to deployment. Lead in the development of Test Plan (Test Scenarios/Test Cases/Test data) and to perform technical/ functional testing to ensure requirements are well met. Manage the SIT and UAT of developed programmes with users. Manage and mitigate test issues and risk. Lead in performing analysis and troubleshooting of defects during testing. To lead and manage projects using both Agile and Waterfall methodology Requirements Qualified professional with a University degree or equivalent Degree in Computing / Computer Science / Engineering preferred. Certified Agile Scrum Master is preferred For AVP: Minimum 8 years of experience in Financial Services industry For VP: Minimum 12 years of experience in Financial Services industry Relevant knowledge and experience with the trade financing and trade applications is preferred. Analytical, solution oriented, and able to propose and follow through both transformational and incremental change Excellent interpersonal skills are required to work within the department, across the broader T&O department, with business partners and with vendors. Strong communication skills, able to communicate effectively at all levels, and both internally and externally. Concise and precise thinking essential Technical hands on experience and work on the various development languages and platforms like Java/J2EE, WebSphere, JBoss, SQL, Oracle, RBMS, MariaDB, IBM CICS, Cobol. Experience in building new application systems will be advantageous. Good working knowledge in UNIX/Linux/Windows Platform Good knowledge and programming/supporting experience of IMEX would be advantageous Apply Now We offer a competitive salary and benefits package and the professional advantages of a dynamic environment that supports your development and recognises your achievements."
"Network Security Officer","Job Purpose Manages and supports all aspects of network security. Responsible for evaluating network architecture and hardware/software configurations for security vulnerabilities, assisting network engineers and application developers in creating secure systems and monitoring intranet, extranet, and internet systems for security threats. It included involvement in the implementation or project on new security solution from local initiatives or DBS Group where it aligned with DBS standard, participation in the creation and or maintenance of policies, standards, baseline, guidelines and procedures as well as conduction vulnerabilty audits and assessments Responsibilities · Manage operation of network security devices, such as Firewall, Firewall Management · Manage operation of antivirus server and endpoint security server · Prepare Weekly Firewall ISS Dashboard for internal and group · Provide Security advisory and awareness to other unit · Review Firewall changes request · Review Security Deviation request · Perform Firewall rules review periodically · Perform Network security devices health check review periodically Involved and ensure completeness of ISS Project Required Experience · University degree in field of IT/Computer Science · Having Security & Network Certification such as: CCIP, JNCIP-SEC · Having knowledge in Security event monitoring and incident response tool, and security event monitoring and incident response tool · Having knowledge in Network protocols, and security tools and devices, e.g. Firewall, IPS, VPN · Having knowledge in Web Application Firewall, such as F5 ASM · Having knowledge in Application Delivery Control, such as F5 LTM"
"Analyst / Associate, Murex Support, Investment Trading Technology, Technology & Operations","Business Function Group Technology and Operations (T&O) enables and empowers the bank with an efficient, nimble and resilient infrastructure through a strategic focus on productivity, quality & control, technology, people capability and innovation. In Group T&O, we manage the majority of the Bank's operational processes and inspire to delight our business partners through our multiple banking delivery channels. Responsibilities To provide day-to-day production support for the Murex/MLC users (Front office, Back-office, Finance etc). To carry out Duty Support rotations among the team members. Mostly on-call basis during off office hours. Able to work shift hours during support duty week and to carry out implementations on weekends. Trouble-shoot Technical related problems and take corrective action To develop monitoring tools/alerts to create proactive actions To work with third party vendor/support team to provide a seamless support model for the business. Able to take ownership of issues and follow through to closure. To coordinate and perform system maintenance process. To setup and support Murex/MLC Environments for User Acceptance Testing. To assist in rolling out of new Murex/MLC version of the application adhering to the best practices of the release management procedures. To be able to drive himself/herself to learn new things while dealing with daily production support To communicate effectively and work efficiently with a group of people supporting both functional/technical areas. Requirements Technical Experience Bachelor’s degree in Computer Engineering/ School of Computing/ Finance IT/ other related IT degrees would be preferred. IT Support experience with minimum 2 years would be desirable. Technical skills on Sybase/Oracle SQL, Unix Shell scripting is highly desirable. Working experiences in a Unix platform is a must. Skills in Windows/Linux environment is a plus. Experience with Symphony (Grid Computing) would be a plus. Development skills (Java, C++) and knowledge of standard technologies (HTML, Javascript, XML, J2EE) is a plus. Non-technical Experience Experience in supporting Murex/MLC application would be greatly desired. Experience with CMMI processes and documentation is preferred. Experience in supporting Treasury & Markets Applications is a plus. Possesses CFA level 1 and above is a plus. Working in a very collaborative and agile team, you are expected to work interdependently – collaborate, negotiate, make trade-offs, handle conflicts. Strong capability to solve problems, be an out-of-box thinker who frequently comes up with new ideas. Good communication skills and ability to articulate to internal users with clear and precise answers. Apply Now We offer a competitive salary and benefits package and the professional advantages of a dynamic environment that supports your development and recognises your achievements."
"VP, FRDM Target Vision Development Manager, Core Systems Technology, Technology and Operations","Business Function Group Technology and Operations (T&O) enables and empowers the bank with an efficient, nimble and resilient infrastructure through a strategic focus on productivity, quality & control, technology, people capability and innovation. In Group T&O, we manage the majority of the Bank's operational processes and inspire to delight our business partners through our multiple banking delivery channels. Responsibilities Supervise the development team with hand-on approach. Ensure development activities per planned timeline, budget, and expected quality parameters. Review and enforce development guidelines for the team to follow. Conversant of current and up-coming technologies & tools especially in the areas of pre-processing, data-warehousing, and analytics. Deep knowledge and experience on Hadoop and related technology stacks. Ensure adherence to all processes and standards pertaining to the applications. Manage regular communication with key stakeholders to ensure seamless and an integrated working model across locations, updates on the teams and book of work. Requirements Bachelors Degree holder in engineering, computer science or related disciplines More than 12 years’ IT experience, especially related to pre-processing, data warehousing and analytics. Conversant in technologies and tools related to finance & risk computation engines, data consolidation and warehousing technologies such as Hadoop, analytics and reporting tools. Familiar with service oriented architecture, parallel processing, horizontal scaling, high performance computing. Apply Now We offer a competitive salary and benefits package and the professional advantages of a dynamic environment that supports your development and recognises your achievements."
"VP, Regional Open Systems Platform Lead (Specialized Platform Team), Tech Services, Technology & Operations","Business Function Group Technology and Operations (T&O) enables and empowers the bank with an efficient, nimble and resilient infrastructure through a strategic focus on productivity, quality & control, technology, people capability and innovation. In Group T&O, we manage the majority of the Bank's operational processes and inspire to delight our business partners through our multiple banking delivery channels. Responsibilities To design, implement and operate network solutions to support business and network projects and ensure timely delivery and compliance to internal technical standards and processes. Strategize and manage the relationships between portfolio management and regional IT teams to improve the operation model process and governance. Troubleshoot and drive system recovery. Escalate problems with actual or potential major impact to problem management and IMS management. Perform root cause analysis and ensure planned actions are carried out to prevent recurrence. Must be proactive and possess a sense of urgency during service recovery Strategize Open systems platform and manage the regional alignment for Design the bank, Run the bank and Change the bank operation model Assist and govern the regional (Design the bank) initiatives and BAU to be align and ensure consistency to the DBS architecture framework and platform cookbook. Collaborate and work with other internal team to develop technical solutions, plans and configuration, in response to requirements from Business and Application teams. Establish configuration standard and design guideline for OS platform, system software, covering availability, performance, resilience, monitoring, backup and recovery functional Troubleshoot and drive system recovery. Escalate problems with actual or potential major impact to problem management and IMS management. Perform root cause analysis and ensure planned actions are carried out to prevent recurrence. Must be proactive and possess a sense of urgency during service recovery Lead and control the delivery of outsourcer technical team of UNIX /Windows system administrators. Ensure the supportability of the OS and system software. Plan and lead upgrade projects. Review and approve change requests. Supervise execution for major change Conduct performance analysis and tuning Automate system operation Requirements Minimum 7 years system support experience on AIX, Solaris, Linux and Wintel platform. Worked in a leadership role for minimum of 3 years. Regional experience is preferred. Possess good technical knowledge of AIX, Solaris, x86 hardware, operating system and system services (volume manager, file system, NTP, DNS, clustering, SSH, TSM, ITM etc). Experience in troubleshoot and performance tuning of UNIX/Wintel Experience in implementing and operating UNIX server clustering Information security knowledge. Data communication and network knowledge. Experience in middleware and application execution in the UNIX environment is an added advantage Apply Now We offer a competitive salary and benefits package and the professional advantages of a dynamic environment that supports your development and recognises your achievements."
"VP/AVP, Delivery Manager – HR Applications, Core Systems Technology, Technology and Operations","Business Function Group Technology and Operations (T&O) enables and empowers the bank with an efficient, nimble and resilient infrastructure through a strategic focus on productivity, quality & control, technology, people capability and innovation. In Group T&O, we manage the majority of the Bank's operational processes and inspire to delight our business partners through our multiple banking delivery channels. Responsibilities Manages human resource application projects to achieve business goals or objectives; works in a coordinated manner to ensure proper allocation of resources and high client satisfaction Anticipates and plans for how project team decisions impact the client. Participates in planning for implementation of solutions, including defining requirements, proof of concepts etc. Works directly with client base to understand HR processes and strategies and when to leverage technology and scope work in order to achieve desired business results. Manages the delivery of business results involving complex and interconnected HR processes and/ or technologies and one or more business partners and/or vendors/implementation partners Manage delivery of enhancement/interface with PeopleSoft HRMS. Prioritizes multiple complex projects; ensures that projects meet specified time lines and deliver expected requirements and results on time and in alignment with stakeholders Influences operational and executive leadership to create and maintain alignment around the project business objectives, measurable benefits, success criteria, scope and constraints impacting project delivery. Requires minimal direction in handling challenging or complex situations. Requirements Around 10+ years experience in financial services industry, managing applications used by the HR. Degree in Computer Science will be an added advantage. Knowledge of Human Resource applications in a Corporate Banking environment is useful. Ability to manage vendor relationship including vendor cost and KPI management, and ability to manage the budget for the department is essential Prior experience partnering with the business to manage applications delivery. Must be analytical, solution oriented, and able to propose and follow through both transformational and incremental changes Great teamwork and partnership skills. Ability to influence others to work towards common goal. Must be a self –starter Strong communication skills, ability to communicate effectively at all levels, and both internally and externally. Concise and precise communication style is essential Ability to lead and drive major changes in the organisation. Champion for change. Ability to inspire others. Familiarity with mobile and web applications. Knowledge of software packages such as PeopleSoft HCM suite preferred. Proficiency in Microsoft Project, Visio, PowerPoint, Sharepoint 2013 and Excel Apply Now We offer a competitive salary and benefits package and the professional advantages of a dynamic environment that supports your development and recognises your achievements."
