"title","requirement"
"Automation Tester","Qualifications & Experience · A graduate in computers or Engineering from a reputed university. ISTQB/SeeTest/UFT certification is a must · 6 -9 years of dedicated experience in automation testing · Should possess excellent programming skills. · Extensive working experience with QTP/UFT tool. Preferably 3 years of working experience in mobile test automation will be an added advantage · The exposure to SeeTest mobile automation tool and web service automation will be a plus · Preferably 2+ years of working knowledge of programming languages Java, .net, C# or VB · Good understanding of various automation framework design using UFT · Excellent test design skills. · Excellent written and verbal communication and presentation skills · Possesses strong analytical, process-oriented, risk management abilities. · A team player with positive attitudes to learn, share and ability to stay focused when challenges arise. · Strong sense of responsibility and urgency; resourceful, strong problem-solving skills and able to work under pressure. · Good understanding of software testing methodologies Responsibilities · Able to work in a team or as an independent contributor. · Assist test lead, test manager in automation planning. · Work with the development and manual testing team to capture and reuse automated test cases, test stubs and drivers, and other test objects · Work with various teams to create, define and maintain and execute automation test suits for various applications. · Assist the test manager with accurate and precise estimates, with confidence and foreseeable dependencie and risks · Document report and track the closure of the defect identified during automation runs. · Track and publish the status or development, maintenance and execution of automation test suits. Assist the Test Manager/Test Lead in the creation of test project status reports and tracking KIP’s and metrics. · Work with the release management and deployment team to create and maintain an automated nightly build verification (“smoke”) test · Ensure proper version control and configuration management of all test objects developed and test environments used · Collaborate with the business analysts (BA) and Technical specialists during the requirement gathering phase to review & define automation requirements and scope"
"Tester","Role : Tester Mandatory skills/Experience Technical / Functional Skills · Over all 3 to 5 years of experience in testing. · At least 3 years of experience in data ware house testing. · At least 2 Years of experience in BFSI domain. · Must have knowledge in Data warehouse and ETL Processes. · Expertise in Teradata queries. · Understand user requirements and mapping documents to design test cases with suitable test design techniques. · Expertise in SDLC and STLC process. · Experience in System testing, System integration testing. · Expertise in HP QC ALM with all modules. · Expertise in defect tracking. · Experience in UAT support. · Provide status report against the Run plan assigned on daily basis. · Excellent written and verbal communication and presentation skills Desirable Educational qualifications · BS/BE CS degree or equivalent · ISTQB or any equivalent testing related certification is added advantage. · Possesses strong analytical, process-oriented, and risk management abilities · Strong communication skills with demonstrated ability and clear concise business communications in English language. · Experience / Knowledge on Automation tool is a plus."
"Frontend Developer","Responsibilities: · Able to analyze the requirement from Business team & document · Writes robust, clean and documented code · Maintenance, Support and ensure necessary changes are implemented · Involve in system integration testing and user acceptance testing · Maintain allocated applications by trouble-shooting problems and provide effective solutions · Able to learn modern web , mobile app technologies and functional analysis Requirements: · Master or Degree in Computer Science /Information Technology / Electrical & Electronics Engineering related discipline · Strong knowledge of coding practices with involvement in at least 1 full software development life cycles. · Excellent work attitude, strong problem solving skills, strong critical thinking and communication skills · At least one years of hands-on client-side development in HTML5, CSS, JavaScript, Backbone JS and MVC frameworks such as Node.js, Angular js · Expert in IOS native app development & Hybrid App using Phone Gap / cordova · Experience on SOAP, REST services using JSON or XML · Experience on Good Dynamics/ e-Signature/OCR/PayPal/Face book integration is a plus. · Good sense of creativity and innovation is expected. · Excellent knowledge of programming concepts and object-oriented programming · Able to work independently to meet project deadlines with minimum supervision and a good team player. · Good reading, writing and speaking in English."
"Java Developer/Sr. Java Developer","Required Experience: § 5 to 8 years experience in Java and J2EE application development in a web environment § Experience with Frameworks such as Struts, Spring, Hibernate is a must § Knowledge and working experience in Oracle or SQL Server is preferred § Working knowledge in HTML, JavaScript, and CSS development is a must § Experience in Vaadin/GWT highly preferred § Excellent interpersonal, verbal/written communication and presentation skills is a must § Provider- AND consumer-side programming using Java Web Services and XML § Web Services using protocols like SOAP § Object Oriented Analysis & Design § Understanding of SSO concepts § Familiarity with multi-tier (App / Web / DB) server architecture § Experience in Consumer Banking"
"Mobile Developer","Position Title: Mobile Developer Responsibilities: · Able to analyze the requirement from Business team & document · Writes robust, clean and documented code · Maintenance, Support and ensure necessary changes are implemented · Involve in system integration testing and user acceptance testing · Maintain allocated applications by trouble-shooting problems and provide effective solutions · Able to learn modern web , mobile app technologies and functional analysis Requirements: · Master or Degree in Computer Science /Information Technology / Electrical & Electronics Engineering related discipline · Strong knowledge of coding practices with involvement in at least 1 full software development life cycles. · Excellent work attitude, strong problem solving skills, strong critical thinking and communication skills · 2+ years of experience in mobile app development on iOS platform. · Working experience on iOS 7.x and above with ARC and Storyboard concepts. · Good knowledge of iOS frameworks such as UIKit, Core Data, Security, etc. · Designing REST API for Mobile. · Experience with third-party libraries and REST APIs · Fair understanding of Android, Hybrid app development technologies. · Debugging skills using XCode instrumentation tools. · Experience with source code management tools (ex: SVN, Git) · Exposure to scrum or another agile methodology · Experience on Good Dynamics/e-Signature /OCR/PayPal/Face book integration is a plus. · Good sense of creativity and innovation is expected. · Excellent knowledge of programming concepts and object-oriented programming · Able to work independently to meet project deadlines with minimum supervision and a good team player. · Good reading, writing and speaking in English."
"Development Lead (Core banking)","JOB DESCRIPTION Responsibilities · Work closely with business analysts and project managers to provide accurate estimate and delivery timelines · Provide technical solution from solution design to code delivery · Responsible for development of complex customizations · Be part of agile delivery team, mentoring the agile team, provide technical inputs. · Take responsibility to ensure a high level of design and coding standards are followed · Provide testing support (SIT and UAT) including defect analysis and resolution by the team · Provide status reporting of the development status and risks/issues · Responsible for initiating change and approval from stakeholders and planning defect free production delivery · Responsible for installation and maintaining development environment across projects · Participate in post release meetings and ensure continuous improvement in quality and productivity Requirements · 10-14 years of experience in development with 4+ years of exposure in large Finacle customization projects · Experience in leading and mentoring development team · Sound knowledge of change control process and configuration management and related tools · Experience in a variety of software development approaches and methodologies including Agile and Waterfall · Should have knowledge of core banking functions with ability to review requirements and provide appropriate solutions (CASA/LOANS/TD/Liquidity management/Treasury/CRM) · Should have in-depth technical knowledge in Finacle, customization, report development · Exposure in either of core / WMS / CRM with knowledge of product configuration and menus · Good knowledge of Oracle PL/SQL"
"Production Support Lead (Core Banking)","Job Description Responsibility · Managing Production Support Shift Operations in India and Working with Global Team Lead · End to End Handing of Finacle application production issues from ticket assignment including Issues analysis, Code fix, SIT Testing, UAT Test planning (Scope , duration),UAT support for user, Source promotion to production. · Document Production Support Processes and Reporting(xls, pivoting, ppt, swimlanes, etc) · Monitor and Track Finacle BAU release processes into production. · Managing & Guiding the team members · Managing critical issues (managing reporting, escalations, fixes) · Manage communication for Major Incidents (SLA breaches, Application Major Incidents, Logistics issue) and responsible for communications with senior management · Manage/coordinate recurring issues and ensure long-term resolution through proper Incident and Problem Management · Act as a facilitator and coordinate between various teams like Infrastructure, development team to resolve, analysis of root cause for complex issues and outages · Strong stakeholder management skills with main focus on continuous service improvement, consistent delivery and stability of production. · Establish required process for transfer of production support work to offshore in a risk mitigated manner. Requirements · An undergraduate degree or higher · 10-15 years of experience in the Banking industry with 4+ years in Run-the-Bank (RTB) lead role with a proven track record of working in core banking environment · Experience in Finacle application in code development and fixes (Finacle scripting, product, JRXML, Reports, etc) · Previous experience with a good understanding of RDBMS / Unix / Large banking application. · Strong team player, effective at communicating internationally and used to working closely with remote teams. · Good knowledge of infrastructure technologies used, with focus on AIX/Oracle/Java · Solid understanding of BAU support, incident, problem management processes as well as escalation management across a diversified environment · Understanding of Risk Management, Disaster Recovery, Business Continuity, IT Security Architecture, and IT Regulatory Compliance. · Present facts and recommendations effectively in oral and written form · Pro-active, independent, resourceful and able to work in a team · Willing to travel on short overseas business assignments · String experience of understanding production issues with finding innovative solutions · Experience in getting automation delivered from Team or self · Building skill-matrix and people development Technology Requirements · Production support Experience on Finacle platform · Software Configuration Mgmt, Quality Control Mgmt, Version Control Mgmt · Operating System - AIX / Linux / Windows · Database – Oracle / PL/SQL · Application Servers – IBM Websphere · Middleware technology – MQ, File transfers · Scheduling software"
"VP, Delivery Manager Mobile, Consumer Banking Group, Technology & Operations","Business Function Group Technology and Operations (T&O) enables and empowers the bank with an efficient, nimble and resilient infrastructure through a strategic focus on productivity, quality & control, technology, people capability and innovation. In Group T&O, we manage the majority of the Bank's operational processes and inspire to delight our business partners through our multiple banking delivery channels. Responsibilities Role Scope Delivery Own and drive the outcomes of the Analyse, Design, Build, Test and Implement phases of delivery Manage the allocation of delivery resources to projects based on the prioritisation of demand. Manage delivery releases and their content based on the prioritisation of demand Manage mobile related delivery for DBS across Consumer Banking Relationship Management Prime “delivery” interface with CBG technology leadership and product owners to prioritise the demand for Platform delivery. Actively manage and influence a range of stakeholders (e.g. delivery managers, vendor partners and business stakeholder), including negotiating hard deadlines, delivery issues, critical success factors, pushing back on what cannot be delivered, foreseeing issues and proactively discussing them with stakeholders and escalating issues as appropriate to resolve them effectively. Technology Management Build delivery capability within DBS to run, manage and enhance mobile applications Ensure long term sustainability of mobile technology platforms through asset lifecycle management Establish mobile delivery frameworks to allow for code re-use Establish agile delivery teams across mobile delivery Establish continuous integration and continuous delivery processes and tools to optimize delivery teams Support Provide and build a strong 3rd level support team and processes ensuring production stability of assets under management Requirements Proven track record delivering large complicated projects and programs Experience creating delivery capability from the ground up and building talented teams Experience working with and managing software product vendors Experience building technology platform teams onshore and offshore Experience with mobile application technology delivery, Kony, IOS and Android Demonstrated Experience with Agile delivery Experience running globally distributed projects Apply Now We offer a competitive salary and benefits package and the professional advantages of a dynamic environment that supports your development and recognises your achievements."
"Senior Associate, Risk Business Analyst/Tester, Core Systems Technology, Technology & Operations","Business Function Group Technology and Operations (T&O) enables and empowers the bank with an efficient, nimble and resilient infrastructure through a strategic focus on productivity, quality & control, technology, people capability and innovation. In Group T&O, we manage the majority of the Bank's operational processes and inspire to delight our business partners through our multiple banking delivery channels. Responsibilities Replacement of existing portfolio whom staff was transferred from CST to IBGT End to end project delivery of FRDM related projects with focus on business analysis, good understanding of automated testing and project management will be an advantage - Document functional specification and traceability matrix - Document test plan, test cycles and test cases - Conduct testing and document test results Sound knowledge in the area of Risk especially on Basel II and Basel III will be an advantage Partner with Risk users in the rollout of regulatory and MIS requirements Good supervisory skill as this role requires management of team, ie. Both internal and external resources Engage and provide regular update to management and stakeholders on project status, issue & resolution Apply Now We offer a competitive salary and benefits package and the professional advantages of a dynamic environment that supports your development and recognises your achievements."
"Vice President, Project Manager, Operations Technology, Technology and Operations","Business Function Group Technology and Operations (T&O) enables and empowers the bank with an efficient, nimble and resilient infrastructure through a strategic focus on productivity, quality & control, technology, people capability and innovation. In Group T&O, we manage the majority of the Bank's operational processes and inspire to delight our business partners through our multiple banking delivery channels. Responsibilities Liaise with Business/Ops on major Projects - from conceptualization to implementation Provide Project Management for the delivery of major Projects: Report to Program Manager on status of project delivery Liaise with vendors for project delivery Work with Subject Matter Experts to provide solutions , efforts sizing and functional and design specifications for business initiatives Work with Project Management Centre for project governance Drive contract negotiations, signing and monitoring Create core work products and inspect other work products Track financials and work closely with Business Unit Controllers for financial matters Serve as liaison between Business, Ops and project team Support Group Audit on their involvement in projects Present to Sponsors and Project Steering Committee Ensure the smooth operational rollout of Projects to customers Act as a Project Manager for Projects involving Operations Technology platforms and cross-department coordination. Lead a team of business analysts, technical managers, Subject Matter Experts and vendor leads to deliver the Project Be the single point-of-contact for the business/ops for the Project Be the single point-of-contact for DBS to all vendors/service providers in relation to the Project Develop efficient working relationship and good interactions/communication with the various stakeholders/departments Ensure the smooth operations of Projects after the rollout Report regularly to the management and stakeholders on the project status Requirements Bachelor Degree holder PMP certified (advantageous) Agile ScrumMaster certification (advantageous) Excellent oral and written communication skills Good, sound knowledge of banking and technology Good teamwork and inter-relationship skills Adaptable, disciplined and focused Organised and systematic Proven analytical skills IT software development life cycle Agile software delivery (advantageous) Non-Technical Previous experience in managing large, multi-vendor project implementations is a requirement. Previous vendor management experience is necessary. Possess excellent verbal and written communication skills Degree in Information Technology or equivalent, with minimum 8 years relevant experience in IT system management, of which a minimum of 6 years should be in a Project/Program Manager or in a team lead capacity, preferably in consumer banking PMP certification or have a similar form of accreditation is an advantage. Technical Previous experience on applications analysis, design and development of IT systems. Relevant experience handling projects in the banking industry. Agile ScrumMaster certification is an advantage. Apply Now We offer a competitive salary and benefits package and the professional advantages of a dynamic environment that supports your development and recognises your achievements."
"VP/AVP, Program Manager, Operations Digitisation, Technology and Operations","Business Function Group Technology and Operations (T&O) enables and empowers the bank with an efficient, nimble and resilient infrastructure through a strategic focus on productivity, quality & control, technology, people capability and innovation. In Group T&O, we manage the majority of the Bank's operational processes and inspire to delight our business partners through our multiple banking delivery channels. Responsibilities Defining the case for change Conducting human centered design and customer journeys to develop solutions across business, operations and technology Developing solutions to drive digitisation and operational efficiency Delivering and ensuring the realization of tangible outcomes from digitally-enabled transformation initiatives Working with and presenting to senior management End-to-end management of transformation projects from the initiation phase (business case) to the execution phase (setup, status update, tracking and implementation) Providing leadership to the program to equip them with the necessary skills to perform their roles through consultative management Driving a team of skilled SMEs across the internal technology units (e.g. Application Teams, Infrastructure Team, Deployment Team), corporate support functions and external vendors to ensure that issues and opportunities are managed and tracked holistically Lead work stream(s) to ensure alignment to the strategic objectives Provide timely update and status reports on progress of projects against the scope, schedule and budget Ensures that the implementation is done in a consistent and standardized fashion across all locations, all business technology areas. Responsible for orchestration and delivery of change management and communications Able to articulate progress/coverage on our overall landscape and provides regular score-cards and status update to senior stakeholders Requirements Minimum 7-12 years of relevant work experience with proven record of delivering strategic transformation and change programs Excellent problem solving and analytical ability – be able to propose and follow through both transformational and incremental change Excellent written and verbal communications skills – with proven ability to facilitate workshops and present to a senior audience Proven leadership and people management skills required – with demonstrated ability to work independently and manage teams and initiatives in a fast-paced environment Strong interpersonal and relationship skills – with proven ability to develop positive stakeholder relationships, through effective engagement and communications Driven, strategically focused, and organized with strong attention to detail – with ability to synthesize and present to senior management Established record in leading and managing multiple work streams within budget and tight deadlines Strong financial modelling and analysis ability, with high proficiency in Microsoft Excel and Powerpoint Bachelor Degree in Business, Computer Science or Engineering, MBA is preferred Highly Advantageous Consulting experience in a top tier consulting company Strong knowledge and familiarity with Singapore banking and financial services industry landscape Experience with Banking Operations Digitisation and Human Centered Design Experience and familiarity with strategy and decision-making frameworks Experience with SDLC and agile methodologies and frameworks Project management certification (PRINCE2, PMBOK) Apply Now We offer a competitive salary and benefits package and the professional advantages of a dynamic environment that supports your development and recognises your achievements."
"Senior Analyst Programmer, Technology","DBS. Living, Breathing Asia. DBS is a leading financial services group in Asia, with over 280 branches across 18 markets. Headquartered and listed in Singapore, DBS has a growing presence in the three key Asian axes of growth: Greater China, Southeast Asia and South Asia. The bank's capital position, as well as ""AA-"" and ""Aa1"" credit ratings, is among the highest in Asia-Pacific. DBS has been recognised for its leadership in the region, having been named “Asia’s Best Bank” by The Banker, a member of the Financial Times group, and “Best Bank in Asia-Pacific” by Global Finance. The bank has also been named “Safest Bank in Asia” by Global Finance for seven consecutive years from 2009 to 2015. Responsibilities Maintain and support the front office securities trading systems to provide good functionality, availability, performance and security. Perform requirement analysis, system analysis, design, development, testing and implementation on schedule. Prepare application systems documentation. Support users in using the application systems. Follow and develop good programming practice and guidelines. Acquire new technologies and propose appropriate solutions for solving user requirements. Requirements Degree holder in Computer Science or related discipline Possess minimum of 4 years’ relevant experiences in financial IT system analysis, design, development and implementation Proficiency in Oracle application development tools and Java technology Experience in FIX application development and support will be an advantage Good understanding of Object Oriented Design, Java technology and distributed programming would be required Strong ability to work under challenging schedule and deadlines Independent with good analytical and communication skills Reliable, intelligent, diligent and good problem solving skills Apply Now We offer a competitive salary and benefits package and the professional advantages of a dynamic environment that supports your development and recognises your achievements. We regret only shortlisted candidates will be notified."
